Senior JavaScript Developer,Laskie,💰 $40k - $60k,Latin America,2021-12-21T17:59:05+00:00,https://remoteok.com/remote-jobs/107848-remote-senior-javascript-developer-laskie,"[""Laskie \n\n\n\nlaskie.co \n\n\nApply now\n\n\n🔎1,851 views\n\n\n✅ 110 applied\n(6%)\n\n\n\nLaskie is also hiring a:\n\n\n\nProduct Manager \nSenior DevOps Engineer \nSenior Software Engineer \nSenior Frontend Developer \nEngineering Manager  \n\n\nLaskie is hiring a Remote Senior JavaScript Developer \nLaskie is helping a few world class startups find talented full stack JavaScript developers for a number of Senior Software Engineer roles based in Latin America.\\n\\nYou will be employed directly by one of these startups and play an integral role in their growth. We are looking for developers who are passionate about building scalable systems and owning development efforts.\\n\\nIf you're an expert React and Node.js developer who is eager to take on complex problems, we'd love to hear from you!\\n\\n**What You Bring**\\n* Professional English fluency, both writing & speaking\\n* 6+ years of work experience as a software engineer\\n* Frontend: 4+ years using React or React Native\\n* Backend: 4+ years using Node.js with PostgreSQL or MongoDB\\n* Experience with test-driven development using frameworks like Mocha and Jest\\n* Experience working with Docker or Kubernetes is a plus\\n\\n**What You’ll Accomplish**\\n* Architect robust and scalable solutions\\n* Build new products from scratch & develop new features for existing products\\n* Collaborate with other Product teams to specify new features & designs\\n* Mentor junior developers on technical skills & professional development\\n\\n**The Right Fit**\\n* You have a growth mindset and believe in game-changing innovations.\\n* You take your impact seriously. You are passionate about building solutions that create sustainable, resilient, long-lasting value.\\n* You are a first-rate software engineer, with experience and a proven ability to think strategically, creatively, commercially, and programmatically.\\n\\n**What's In It For You?**\\n* $1000 Laskie signing bonus PLUS any signing bonus offered by our clients\\n* All of our clients offer remote work and competitive compensation with bonuses, stock options, and PTO\\n* Apply once and get matched with multiple pre-vetted employers \\n\\nBe sure to mention the word **INVIOLATE** when applying to show you read the job post completely. This is a beta feature to avoid spam applicants. Companies can search these words to find applicants that read this and see they're human.\\n\\n \\n\\n#Salary and compensation\\n\n$60,000 — $100,000/year\\n\n\\n\\n#Location\\nLatin America\n\n\n\n\nSee more jobs at Laskie\n\n\nVisit Laskie's website""]",https://remoteok.com,REMOTEOK
Senior Technical Recruiter,Clevertech,💰 $40k - $60k,🌏 Worldwide,2021-12-21T17:56:06+00:00,https://remoteok.com/remote-jobs/107847-remote-senior-technical-recruiter-clevertech,"[""Clevertech \n\n\n\nclevertech.biz \n\n\nApply now\n\n\n🔎1,165 views\n\n\n✅ 149 applied\n(13%)\n\n\n\nClevertech is also hiring a:\n\n\n\nSourcing Specialist  \n\n\nClevertech is hiring a Remote Senior Technical Recruiter \nOur 100% remote team of 400+ CleverPeople are seasoned yet friendly professionals who want to collaborate and welcome you. We have an exciting new opening for a Senior Technical Recruiter.\\n\\n**What we're working on**\\nEnterprise companies turn to us to help them launch innovative digital products that interact with hundreds of millions of customers, transactions and data points. The problems we solve everyday are real and require creativity, grit and determination. We are building a culture that challenges norms while fostering experimentation and personal growth. We are hiring team members who are passionate and energized by the vision of empowering our customers in a complex industry through technology, data and a deep understanding of client concerns. In order to grasp the scale of problems we face, ideally you have some exposure to Logistics, FinTech, Transportation, Insurance, Media or other complex multifactor industries.\\n\\nLeading software development consultancy, Clevertech, is looking to hire a Senior Technical Recruiter to support our team’s rapid growth. You will be integral to the development and success of our organization while also being able to take advantage of the many meaningful, career-developing opportunities you’ll be provided.\\n\\n**Responsibilities**\\nLiaise with candidates throughout the interview process to ensure an efficient, positive experience\\nCreate interesting and appealing job descriptions\\nActively source candidates on various platforms and facilitate them through the process using our in-house ATS software program\\nOwn the organization and coordination of internal recruiting tools\\nHelp to develop and improve recruiting processes (tracking candidate data and metrics relevant to process performance)\\nOpportunity to work on other projects as needed within the Talent department\\nThis position will join a team of 4 recruiters and will primarily be focused on recruiting software developers in the US and Canada\\n\\n**Requirements**\\nAt least 4 years of professional work experience, with impressive accomplishments\\nAbility to effectively manage simultaneous projects and prioritize tasks\\nStrong attention to detail and master of organization\\nHigh level of resourcefulness\\nHigh sense of urgency\\nTech-Savvy\\n\\nUltimately, our ideal candidate is someone who is highly organized and strives to get things done efficiently in a fast-moving environment. \\n\\nBe sure to mention the word **UNDISPUTABLE** when applying to show you read the job post completely. This is a beta feature to avoid spam applicants. Companies can search these words to find applicants that read this and see they're human.\\n\\n \\n\\n#Salary and compensation\\n\n$40,000 — $60,000/year\\n\n\\n\\n#Location\\n🌏 Worldwide\n\n\n\n\nSee more jobs at Clevertech\n\n\nVisit Clevertech's website""]",https://remoteok.com,REMOTEOK
Sourcing Specialist,Clevertech,💰 $60k - $100k,🌏 Worldwide,2021-12-21T17:52:18+00:00,https://remoteok.com/remote-jobs/107846-remote-sourcing-specialist-clevertech,"[""Clevertech \n\n\n\nclevertech.biz \n\n\nApply now\n\n\n🔎1,695 views\n\n\n✅ 136 applied\n(8%)\n\n\n\nClevertech is also hiring a:\n\n\n\nSenior Technical Recruiter  \n\n\nClevertech is hiring a Remote Sourcing Specialist \nOur 100% remote team of 400+ CleverPeople are seasoned yet friendly professionals who want to collaborate and welcome you. We have an exciting new opening for a Sourcing Specialist.\\n\\n**What we're working on**\\nEnterprise companies turn to us to help them launch innovative digital products that interact with hundreds of millions of customers, transactions and data points. The problems we solve everyday are real and require creativity, grit and determination. We are building a culture that challenges norms while fostering experimentation and personal growth. We are hiring team members who are passionate and energized by the vision of empowering our customers in a complex industry through technology, data and a deep understanding of client concerns. In order to grasp the scale of problems we face, ideally you have some exposure to Logistics, FinTech, Transportation, Insurance, Media or other complex multifactor industries.\\n\\nLeading software development consultancy, Clevertech, is looking to hire a Sourcing Partner to support our team’s rapid growth. You will be integral to the development and success of our organization while also being able to take advantage of the many meaningful, career-developing opportunities you’ll be provided.\\n\\n**Responsibilities**\\nLiaise with candidates throughout the interview process to ensure an efficient, positive experience\\nActively source candidates on LinkedIn Recruiter and facilitate them through the process using our in-house ATS software program\\nCrafting action plans for effective sourcing\\nOpportunity to work on other projects as needed within the Talent department\\nThis position will join a team of 4 recruiters and will primarily be focused on recruiting software developers in the US and Canada\\n\\n**Requirements**\\nAt least 5 years of experience in sourcing, preferably in an international market\\nAbility to effectively manage simultaneous projects and prioritize tasks\\nStrong attention to detail and master of organization.\\nPrevious experience coordinating with Technical Recruiters, Sourcers and Hiring Managers\\nHigh level of resourcefulness\\nHigh sense of urgency\\nTech-Savvy\\n\\n**Who you are**\\nYou bring technical sourcing experience for mobile, web, and software development organizations, attracting various roles including Full Stack, Front and Back End Engineers, DevOps, QA and Data Science profiles.\\nYou love to communicate with past applicants regarding new job opportunities, and you love to pull reports to show your progress and updates.\\nUltimately, our ideal candidate is someone who is highly organized and strives to get things done efficiently in a fast-moving environment. \\n\\nBe sure to mention the word **COURAGEOUS** when applying to show you read the job post completely. This is a beta feature to avoid spam applicants. Companies can search these words to find applicants that read this and see they're human.\\n\\n \\n\\n#Salary and compensation\\n\n$40,000 — $60,000/year\\n\n\\n\\n#Location\\n🌏 Worldwide\n\n\n\n\nSee more jobs at Clevertech\n\n\nVisit Clevertech's website""]",https://remoteok.com,REMOTEOK
Python Developer,Laskie,💰 $50k - $90k,+- 4 Hours CET,2021-12-21T17:45:53+00:00,https://remoteok.com/remote-jobs/107845-remote-python-developer-laskie,"[""Laskie \n\n\n\nlaskie.co \n\n\nApply now\n\n\n🔎2,270 views\n\n\n✅ 148 applied\n(7%)\n\n\n\nLaskie is also hiring a:\n\n\n\nProduct Manager \nSenior DevOps Engineer \nSenior Software Engineer \nSenior Frontend Developer \nEngineering Manager  \n\n\nLaskie is hiring a Remote Python Developer \nLaskie is helping a few world class, venture-backed startups find talented Backend Engineers specializing in development with Python.\\n\\nYou will be employed directly by one of these startups and play an integral role in their early stage growth. We are looking for developers who are passionate about building scalable systems and owning development efforts.\\n\\nIf you're a skilled backend developer with Python experience and you're excited about making an impact, we'd love to hear from you!\\n\\n**What You Bring**\\n* Professional English fluency, both writing & speaking\\n* 8+ years of work experience as a software engineer\\n* 5+ years of experience building products with Python and Django\\n* Highly proficient in SQL with experience using databases like PostgreSQL\\n* Proficient using noSQL database like MongoDB\\n* Experience managing cloud infrastructure, specifically AWS or GCP\\n* Experience scaling cloud infrastructure with Docker or Kubernetes is a plus\\n\\n**The Right Fit**\\n* You have a growth mindset and believe in game-changing innovations.\\n* You take your impact seriously. You are passionate about building solutions that create sustainable, resilient, long-lasting value.\\n* You are a first-rate software engineer, with experience and a proven ability to think strategically, creatively, commercially, and programmatically.\\n\\n**What You’ll Accomplish**\\n* Architect the backend for new products\\n* Build robust, scalable new features for core products\\n* Help manage infrastructure scaling and reliability\\n* Collaborate with leadership to build product roadmap & strategy\\n\\n**What's In It For You?**\\n* $1000 Laskie signing bonus PLUS any signing bonus offered by our clients\\n* All of our clients offer remote work and competitive compensation with bonuses, stock options, and PTO\\n* Apply once and get matched with multiple pre-vetted employers \\n\\nBe sure to mention the word **BONUS** when applying to show you read the job post completely. This is a beta feature to avoid spam applicants. Companies can search these words to find applicants that read this and see they're human.\\n\\n \\n\\n#Salary and compensation\\n\n$60,000 — $100,000/year\\n\n\\n\\n#Location\\nLatin America\n\n\n\n\nSee more jobs at Laskie\n\n\nVisit Laskie's website""]",https://remoteok.com,REMOTEOK
Senior Frontend Developer,Laskie,💰 $50k - $300k,🌏 Worldwide,2021-12-21T16:38:41+00:00,https://remoteok.com/remote-jobs/107843-remote-senior-frontend-developer-laskie,"[""Laskie \n\n\n\n laskie.co \n\n\nApply now\n\n\n🔎1,814 views\n\n\n✅ 119 applied\n(7%)\n\n\n\nLaskie is also hiring a:\n\n\n\nProduct Manager \nSenior DevOps Engineer \nSenior Software Engineer \nEngineering Manager \nPython Developer  \n\n\nLaskie is hiring a Remote Senior Frontend Developer \nLaskie is helping a few world class, venture-backed startups find talented frontend engineers specializing in development with React.\\n\\nYou will be employed directly by one of these startups and play an integral role in their early stage growth. We are looking for developers who are passionate about building scalable systems and owning development efforts.\\n\\nIf you're a skilled frontend developer with React experience and you're excited about making an impact, we'd love to hear from you!\\n\\n**What You Bring**\\n* Professional English fluency, both writing & speaking\\n* 8+ years of work experience as a software engineer\\n* 4+ years of work experience using React.js (Vue.js, and Angular experience considered)\\n* Experience with test-driven development using frameworks like Mocha and Jest\\n\\n**What You’ll Accomplish**\\n* Design & architect clean user interfaces with reusable components\\n* Build new solutions & develop new features for existing solutions\\n* Collaborate with Product teams to specify new features & designs\\n\\n**The Right Fit**\\n* You have a growth mindset and believe in game-changing innovations.\\n* You take your impact seriously. You are passionate about building solutions that create sustainable, resilient, long-lasting value.\\n* You are a first-rate software engineer, with experience and a proven ability to think strategically, creatively, commercially, and programmatically.\\n\\n**What's In It For You?**\\n* $1000 Laskie signing bonus PLUS any signing bonus offered by our clients\\n* All of our clients offer remote work and competitive compensation with bonuses, stock options, and PTO\\n* Apply once and get matched with multiple pre-vetted employers \\n\\nBe sure to mention the word **CALMNESS** when applying to show you read the job post completely. This is a beta feature to avoid spam applicants. Companies can search these words to find applicants that read this and see they're human.\\n\\n \\n\\n#Salary and compensation\\n\n$50,000 — $90,000/year\\n\n\\n\\n#Location\\nLatin America\n\n\n\n\nSee more jobs at Laskie\n\n\nVisit Laskie's website""]",https://remoteok.com,REMOTEOK
Senior Full Stack Developer,Toptal,💰 $50k - $300k,US Remote,2021-12-20T02:24:06+00:00,https://remoteok.com/remote-jobs/107795-remote-senior-full-stack-developer-toptal,"[""Toptal \n\n\n\ntoptal.com \n\n\nApply now\n\n\n🔎2,162 views\n\n\n✅ 223 applied\n(10%)\n\n\n\nToptal is also hiring a:\n\n\n\nSenior React Developer \nDigital Product Designer \nSenior React Native Developer \nSenior Android Developer \nSenior Ruby On Rails Developer  \n\n\nToptal is hiring a Remote Senior Full Stack Developer \n***Design your full-time freelance career as a top freelance developer with Toptal.***\\n\\nFreelance work is defining developer careers in exciting new ways. If you’re passionate about finding rapid career growth potential working with leading Fortune 500 brands and innovative Silicon Valley startups, Toptal could be a great fit for your next career shift. \\n\\nToptal is an elite talent network made up of the world’s top 3% of developers, connecting the best and brightest freelancers with top organizations. Unlike a 9-to-5 job, you’ll choose your own schedule and work from anywhere.\xa0**Jobs come to you, so you won’t bid for projects against other developers in a race to the bottom.**\xa0Plus, Toptal takes care of all the overhead, empowering you to focus on successful engagements while getting paid on time, at the rate you decide, every time. Our sophisticated screening process makes sure you are provided with top clients without additional overhead, as well as assistance in maximizing the potential of your full-time freelance career. Joining the Toptal network also gives you access to technical training programs, mentors, and coaching programs, so you can connect with a global community of experts like you to share peer-to-peer knowledge and expand your network globally. \\n\\nAs a freelance developer, you can become a part of an ever-expanding community of experts in over 120 countries, working remotely on projects that meet your career ambitions. \\n\\nThat’s why the world’s top 3% of developers choose Toptal. Developers in our elite network share:\\n* English language proficiency\\n* 3+ years of professional experience in software development\\n* Solid experience with\xa0**React.js, Ruby on Rails, Go**\xa0or/and\xa0**Node.js**\xa0is a strong advantage\\n* Project management skills\\n* A keen attention to detail\\n* Experience with system architecture or leading a software team is a strong advantage\\n* Full-time availability is a strong advantage\\n\\nCurious to know how much you could make? Check out our developer rate calculator: [https://topt.al/DwcgPn](https://topt.al/DwcgPn)\\n\\nIf you’re interested in pursuing an engaging career working on full-time freelance jobs for exclusive clients, take the next step by clicking apply and filling out the short form: [https://topt.al/JNcg2W](https://topt.al/JNcg2W) \\n\\nBe sure to mention the word **TWINKLY** when applying to show you read the job post completely. This is a beta feature to avoid spam applicants. Companies can search these words to find applicants that read this and see they're human.\\n\\n \\n\\n#Salary and compensation\\n\n$50,000 — $300,000/year\\n\n\\n\\n#Location\\n🌏 Worldwide\n\n\n\n\nSee more jobs at Toptal\n\n\nVisit Toptal's website""]",https://remoteok.com,REMOTEOK
Senior Front End Developer,Toptal,💰 $50k - $70k,🌏 Worldwide,2021-12-20T02:21:28+00:00,https://remoteok.com/remote-jobs/107794-remote-senior-front-end-developer-toptal,"[""Toptal \n\n\n\ntoptal.com \n\n\nApply now\n\n\n🔎1,840 views\n\n\n✅ 181 applied\n(10%)\n\n\n\nToptal is also hiring a:\n\n\n\nSenior React Developer \nDigital Product Designer \nSenior React Native Developer \nSenior Android Developer \nSenior Ruby On Rails Developer  \n\n\nToptal is hiring a Remote Senior Front End Developer \n***Design your full-time freelance career as a top freelance developer with Toptal.***\\n\\nFreelance work is defining developer careers in exciting new ways. If you’re passionate about finding rapid career growth potential working with leading Fortune 500 brands and innovative Silicon Valley startups, Toptal could be a great fit for your next career shift. \\n\\nToptal is an elite talent network made up of the world’s top 3% of developers, connecting the best and brightest freelancers with top organizations. Unlike a 9-to-5 job, you’ll choose your own schedule and work from anywhere.\xa0**Jobs come to you, so you won’t bid for projects against other developers in a race to the bottom.**\xa0Plus, Toptal takes care of all the overhead, empowering you to focus on successful engagements while getting paid on time, at the rate you decide, every time. Our sophisticated screening process makes sure you are provided with top clients without additional overhead, as well as assistance in maximizing the potential of your full-time freelance career. Joining the Toptal network also gives you access to technical training programs, mentors, and coaching programs, so you can connect with a global community of experts like you to share peer-to-peer knowledge and expand your network globally. \\n\\nAs a freelance developer, you can become a part of an ever-expanding community of experts in over 120 countries, working remotely on projects that meet your career ambitions. \\n\\nThat’s why the world’s top 3% of developers choose Toptal. Developers in our elite network share:\\n\\n* English language proficiency\\n* 3+ years of professional experience in software development\\n* Solid experience with\xa0**React.js**\xa0is a strong advantage\\n* Project management skills\\n* A keen attention to detail\\n* Experience with system architecture or leading a software team is a strong advantage\\n* Full-time availability is a strong advantage\\n\\nCurious to know how much you could make? Check out our developer rate calculator: [https://topt.al/QNcMkP](https://topt.al/QNcMkP)\\n\\nIf you’re interested in pursuing an engaging career working on full-time freelance jobs for exclusive clients, take the next step by clicking apply and filling out the short form: [https://topt.al/bvcMbJ](https://topt.al/bvcMbJ) \\n\\nBe sure to mention the word **GRACIOUSLY** when applying to show you read the job post completely. This is a beta feature to avoid spam applicants. Companies can search these words to find applicants that read this and see they're human.\\n\\n \\n\\n#Salary and compensation\\n\n$50,000 — $300,000/year\\n\n\\n\\n#Location\\n🌏 Worldwide\n\n\n\n\nSee more jobs at Toptal\n\n\nVisit Toptal's website""]",https://remoteok.com,REMOTEOK
Senior Full Stack Developer Ruby React,GOhiring,💰 $60k - $90k,🌏 Worldwide,2021-12-20T00:00:22+00:00,https://remoteok.com/remote-jobs/106045-remote-senior-full-stack-developer-ruby-react-gohiring,"[""GOhiring \n\n\n\ngohiring.com \n\n\nApply now\n\n\n🔎6,131 views\n\n\n✅ 2,873 applied\n(47%)\n\n\n\nGOhiring is hiring a Remote Senior Full Stack Developer Ruby React \nAs a strategic technology partner in data-based recruiting, GOhiring connects employers, applicant management systems, agencies, and job boards. With GOhiring Analytics, we provide transparency into the effectiveness of recruiting measures and offer market participants the certainty of identifying the best solution for their current challenges. \\n\\nWith GOhiring Multiposting, we establish the best integrations with over 500 job boards in the DACH region. We're a team of 20 diverse professionals - with an ambitious vision for the future. With us, you will build products with future proof flexibility that might require thinking inside and outside of the box.\\n\\n**Your role**\\n*\xa0**Impact:**\xa0Build smart and sustainable products that meet external and internal user group’s needs. Look forward to processes that start with MVPs and continuously iterate from there.\\n*\xa0**Complex challenges:**\xa0You will work on the full stack of the whole product-ecosystem and contribute to tasks of all sizes. This includes developing products from scratch.\\n*\xa0**Quality as a goal:**\xa0Follow best practices with us (CI, TDD, PRs, code reviews and good design practices). Proactively monitor and optimise for security and performance.\\n*\xa0**Frontend transition:**\xa0Help us standardize the way we do frontend in our transition towards React (from custom JS and Ember). \\nTeam work: You are an integral part of an experienced development team and you’ll work in close collaboration with product managers and testers.\\n\\n**Your profile**\\n* You get excited about good code quality and engineering quests \\n* You have broad experience in web development and master React and Ruby. More languages as a bonus.\\n* Profound knowledge about API design and first experience with application scalability and performance optimisation (ideally with Heroku, Docker and AWS)\\n* University degree in Computer Science (or equivalent experience)\\n* You’re located +-4 hours CET \\n* Interest in business logic behind the software\\n* Fluent in English \\n\\n**We offer**\\n*\xa0**More than a job - discover the future:**\xa0We’re a profitable and successfully bootstrapped company. You'll work at the heart of digitalization in recruiting and perhaps discover the job of a lifetime.\\n*\xa0**Remote since 2012:**\xa0Look forward to processes and mindsets that are 100% geared towards time-flexible and location-independent work. \\n*\xa0**Making a big difference in a small team:**\xa0We believe that small teams are more fun. Direct collaboration, lots of creative freedom, learning from each other - that's our understanding of productivity.\\n*\xa0**Work equipment of your choice:**\xa0For your mobile job you will receive a laptop and technical setup of your choice. \\nCompetitive salary package: Base salary plus performance-related company-wide bonus and employee stock ownership plan (ESOP).\\n\\n**Want to work together on the future of recruiting?**\\nSimply send us your profile in addition to your Github handle. We are happy to hear from you.\\n\\n*Diversity and equal opportunity are very important to us. We are happy about the interest of all candidates and strive to provide feedback as quickly as possible.*\\n\\n \\n\\nBe sure to mention the word **EXCITING** when applying to show you read the job post completely. This is a beta feature to avoid spam applicants. Companies can search these words to find applicants that read this and see they're human.\\n\\n \\n\\n#Salary and compensation\\n\n$50,000 — $70,000/year\\n\n\\n\\n#Location\\n+- 4 Hours CET\n\n\n\n\nSee more jobs at GOhiring\n\n\nVisit GOhiring's website""]",https://remoteok.com,REMOTEOK
