Sr Software Engineer Data Infrastructure,Doximity,💰 $120k - $160k,"Usa, Uk",2021-12-06T17:50:50+00:00,https://remoteok.com/remote-jobs/107056-remote-sr-software-engineer-data-infrastructure-doximity,"[""Doximity \n\n\n\ndoximity.com \n\n\nApply now\n\n\n🔎1,491 views\n\n\n✅ 842 applied\n(56%)\n\n\n\nDoximity is also hiring a:\n\n\n\nData Engineer Data Integration \nSite Reliability Engineer \nSr Software Engineer Data Platform \nSoftware Engineer Android \nData Analytics Manager  \n\n\nDoximity is hiring a Remote Sr Software Engineer Data Infrastructure \nDoximity is transforming the healthcare industry. Our mission is to help doctors be more productive, informed, and connected. Achieving this vision requires a multitude of disciplines, expertises and perspective. One of our core pillars have always been data. As a software engineer focused on the infrastructure aspect of our data stack you will work on improving healthcare by advancing our data capabilities, best practices and systems. Our team brings a diverse set of technical and cultural backgrounds and we like to think pragmatically in choosing the tools most appropriate for the job at hand.\\n\\nThis role can be filled in our San Francisco headquarters OR remotely in the U.S.\\n\\n**About Us**\\n\\nOur data teams schedule over 1000 Python pipelines and over 350 Spark pipelines every 24 hours, resulting in over 5000 data processing tasks each day. Additionally, our data endeavors leverage datasets ranging in size from a few hundred rows to a few hundred billion rows. The Doximity data teams rely heavily on Python3, Airflow, Spark, MySQL, and Snowflake. To support this large undertaking, the data infrastructure team uses AWS, Terraform, and Docker to manage a high-performing and horizontally scalable data stack. The data infrastructure team is responsible for enabling and empowering the data analysts, machine learning engineers, and data engineers at Doximity. We provide and evolve a foundation on which to build, and ensure that incidental complexities melt into our abstractions. Doximity has worked as a distributed team for a long time; pre-pandemic, Doximity was already about 65% distributed.\\n\\nOur [company core values](https://work.doximity.com/)\\n\\nOur [recruiting process](https://technology.doximity.com/articles/engineering-recruitment-process-doximity)\\n\\nOur [product development cycle](https://technology.doximity.com/articles/mofo-driven-product-development)\\n\\nOur [on-boarding & mentorship process](https://technology.doximity.com/articles/software-engineering-on-boarding-at-doximity)\\n\\n\\n**Here's How You Will Make an Impact**\\n\\nAs a data infrastructure engineer you will work with the rest of the data infrastructure team to design, architect, implement, and support data infrastructure, systems, and processes impacting all other data teams at Doximity. You will solidify our CI/CD pipelines, reduce production impacting issues and improve monitoring and logging. You will support and train data analysts, machine learning engineers, and data engineers on new or improved data infrastructure systems and processes. A key responsibility is to encourage data best-practices through code by continuing the development of our internal data frameworks and libraries. Also, it is your responsibility to identify and address performance, scaling, or resource issues before they impact our product. You will spearhead, plan, and carry out the implementation of solutions while self-managing your time and focus.\\n\\n**About you**\\n\\n* You have professional data engineering or operations experience with a focus on data infrastructure\\n* You are fluent in Python and SQL, and feel at home in a remote Linux server session\\n* You have operational experience supporting data stacks through tools like Terraform, Docker, and continuous integration through tools like CircleCI\\n* You are foremost an engineer, making you passionate about high code quality, automated testing, and engineering best practices\\n* You have the ability to self-manage, prioritize, and deliver functional solutions\\n* You possess advanced knowledge of Linux, Git, and AWS (EMR, IAM, VPC, ECS, S3, RDS Aurora, Route53) in a multi-account environment\\n* You agree that concise and effective written and verbal communication is a must for a successful team\\n\\n**Benefits & Perks**\\n\\n* Generous time off policy\\n* Comprehensive benefits including medical, vision, dental, generous paternity and maternity leave, Life/ADD, 401k, flex spending accounts, commuter benefits, equipment budget, and continuous education budget\\n* Stock incentives\\n* and much more! For a full list, see our career page\\n\\n**More info on Doximity**\\n\\nJoining Doximity means being part of an incredibly talented and humble team. We work on amazing products that over 80% of US doctors (and over one million healthcare professionals) use to make their busy lives a little easier. We're driven by the goal of improving inefficiencies in our $3.5 trillion U.S. healthcare system and love creating technology that has a real, meaningful impact on people's lives. To learn more about our team, culture, and users, check out our careers page, company blog, and engineering blog. We're growing steadily, and there's plenty of opportunities for you to make an impact.\\n\\n*Doximity is proud to be an equal opportunity employer and committed to providing employment opportunities regardless of race, religious creed, color, national origin, ancestry, physical disability, mental disability, medical condition, genetic information, marital status, sex, gender, gender identity, gender expression, pregnancy, childbirth and breastfeeding, age, sexual orientation, military or veteran status, or any other protected classification. We also consider qualified applicants with criminal histories, consistent with applicable federal, state, and local law.*\\n\\n\\n \\n\\nBe sure to mention the word **SATISFACTORILY** when applying to show you read the job post completely. This is a beta feature to avoid spam applicants. Companies can search these words to find applicants that read this and see they're human.\\n\\n \\n\\n#Salary and compensation\\n\n$120,000 — $160,000/year\\n\n\\n\\n#Location\\nNorth America\n\n\n\n\nSee more jobs at Doximity\n\n\nVisit Doximity's website""]",https://remoteok.com,REMOTEOK
Site Reliability Engineer,Doximity,💰 $120k - $160k,🌏 Worldwide,2021-12-06T16:38:47+00:00,https://remoteok.com/remote-jobs/107059-remote-site-reliability-engineer-doximity,"[""Doximity \n\n\n\ndoximity.com \n\n\nApply now\n\n\n🔎2,094 views\n\n\n✅ 949 applied\n(45%)\n\n\n\nDoximity is also hiring a:\n\n\n\nSr Software Engineer Data Infrastructure \nData Engineer Data Integration \nSr Software Engineer Data Platform \nSoftware Engineer Android \nData Analytics Manager  \n\n\nDoximity is hiring a Remote Site Reliability Engineer \nDoximity is transforming the healthcare industry. Our mission is to help doctors be more productive, informed, and connected.\xa0As a software engineer, you'll work within cross-functional delivery teams alongside other engineers, designers, and product managers in building software to help improve healthcare.\xa0\xa0\\n\\nOur [team](https://www.doximity.com/about/company#theteam)\xa0brings a diverse set of technical and cultural backgrounds and we like to\xa0think pragmatically in choosing the tools most appropriate for the job at hand.\\n\\nOne of Doximity's\xa0core values\xa0is stretching ourselves. Even if you don't check off all the boxes below we encourage you to apply. Doximity is full of exceptional people that don't fit a mold, join us!\\n\\nThis role can be filled in our San Francisco headquarters OR remotely in the U.S.\\n\\n**About you**\\n* You have a background in web development (preferably Ruby on Rails)\\n* You are interested in performance related problems and designing resilient systems\xa0\\n* You want to become highly proficient in relational and non relational data stores\\n* You understand the core features of cloud providers (preferably with an understanding of how to define infrastructure as code with a tool such as Terraform)\\n* You enjoy collaborating with others to write excellent software and to resolve production incidents\\n\\n\\n**Here’s How You Will Make an Impact**\\n* Improve the performance and scalability of services\\n* Troubleshoot issues across the whole stack; ingress, application, network, databases etc\\n* Manage infrastructure using Terraform and Kubernetes\\n* Create concise postmortems in the event of an outage\\n* Write and maintain run-books for other engineers to leverage\\n* Ensure proper monitoring, alerting, and dashboarding for applications you support\\n* Collaborate with other engineers to make sound infrastructure decisions, improve workflow, and deploy applications ready for production\\n* Participate in an on-call rotation (great ratio of time on call vs off call)\\n\\n**About Us**\\n\\n* Here are some of the ways we [bring value to doctors](https://drive.google.com/file/d/1qimYh0mG3i1nTJe6jDCDepJt2i4o8MEB/view)\\n* Our\xa0web applications are\xa0built\xa0primarily\xa0using Ruby, Rails, Javascript (Vue.js), and\xa0a bit of\xa0Golang\\n* Our data engineering stack run on Python, MySQL, Spark, and Airflow\\n* Our production application stack is hosted on AWS and we deploy to production on average 85 times per day\\n* We have over 500 private repositories in Github containing our applications, forks of gems, our own internal gems, and [open-source projects](https://github.com/doximity)\\n* We have worked as a distributed team for a long time; we're currently over 65% distributed\\n\\nFind out more information on the Doximity [engineering blog](https://technology.doximity.com/)\\n\\nOur [company core values](https://work.doximity.com/)\\n\\nOur [recruiting process](https://technology.doximity.com/articles/engineering-recruitment-process-doximity)\\n\\nOur [product development cycle](https://technology.doximity.com/articles/mofo-driven-product-development)\\n\\nOur [on-boarding & mentorship process](https://technology.doximity.com/articles/software-engineering-on-boarding-at-doximity)\\n\\n\\n**Benefits & Perks**\\n\\n* Generous time off policy\\n* Comprehensive benefits including medical, vision, dental, generous paternity and maternity leave, Life/ADD, 401k, flex spending accounts, commuter benefits, equipment budget, and continuous education budget\\n* Stock incentives\\n* and much more! For a full list, see our career page\\n\\n**More info on Doximity**\\n\\nJoining Doximity means being part of an incredibly talented and humble team. We work on amazing products that over 80% of US doctors (and over one million healthcare professionals) use to make their busy lives a little easier. We’re driven by the goal of improving inefficiencies in our $3.5 trillion U.S. healthcare system and love creating technology that has a real, meaningful impact on people’s lives. To learn more about our team, culture, and users, check out our careers page, company blog, and engineering blog. We’re growing steadily, and there’s plenty of opportunity for you to make an impact.\\n\\n*Doximity is proud to be an equal opportunity employer, and committed to providing employment opportunities regardless of race, religious creed, color, national origin, ancestry, physical disability, mental disability, medical condition, genetic information, marital status, sex, gender, gender identity, gender expression, pregnancy, childbirth and breastfeeding, age, sexual orientation, military or veteran status, or any other protected classification. We also consider qualified applicants with criminal histories, consistent with applicable federal, state and local law.* \\n\\nBe sure to mention the word **IMPRESS** when applying to show you read the job post completely. This is a beta feature to avoid spam applicants. Companies can search these words to find applicants that read this and see they're human.\\n\\n \\n\\n#Salary and compensation\\n\n$120,000 — $160,000/year\\n\n\\n\\n#Location\\n🇺🇸 US\n\n\n\n\nSee more jobs at Doximity\n\n\nVisit Doximity's website""]",https://remoteok.com,REMOTEOK
Sr Software Engineer Data Platform,Doximity,💰 $120k - $160k,"Sunnyvale, CA",2021-12-06T16:38:13+00:00,https://remoteok.com/remote-jobs/107061-remote-sr-software-engineer-data-platform-doximity,"['Doximity \n\n\n\ndoximity.com \n\n\nApply now\n\n\n🔎1,848 views\n\n\n✅ 901 applied\n(49%)\n\n\n\nDoximity is also hiring a:\n\n\n\nSr Software Engineer Data Infrastructure \nData Engineer Data Integration \nSite Reliability Engineer \nSoftware Engineer Android \nData Analytics Manager  \n\n\nDoximity is hiring a Remote Sr Software Engineer Data Platform \nDoximity is transforming the healthcare industry. Our mission is to help doctors save time so they can provide better care for patients. We value diversity — in backgrounds and experiences. Healthcare is a universal concern, and we need people from all backgrounds to help build the future of healthcare.\\n\\nOne of Doximity\'s core values is stretching ourselves. Even if you don\'t check off all the boxes below we encourage you to apply. Doximity is full of exceptional people that don\'t fit a mold, join us!\\n\\nData engineers on our data services team provide standardized tools, frameworks and libraries to empower data pipelining and analytics endeavors through a horizontally scalable data stack. The data services team is responsible for continuously improving the software environment for our data analysts, machine learning engineers, and data engineers at Doximity. Effectively maintaining and evolving the software layer on which all data teams at Doximity build.\\n\\nThis role can be filled in our San Francisco headquarters OR remotely in the U.S.\\n\\n**How you’ll make an impact**\\n\\nCollaborate with data analysts, data engineers, and machine learning engineers to understand their future needs and current blockers to ensure the Doximity data stack will meet future needs and reduce existing blockers\\nUnderstand what our data product teams are trying to achieve. Principally, to help you propose, architect, design, and implement solutions and best practices to maximize the time they can spend on their immediate goals. While minimizing the time they need to spend on unrelated or redundant technical hurdles\\nContinuously improve our software engineering culture within the data organization by leading through example\\nWork with other teams on isolating and understanding development, performance, and stability issues - together with the data infrastructure team, you will be part of the last line of defense to resolve problems facing members of our data teams.\\n\\n**What we’re looking for**\\n\\n* You have professional data engineering or internal tooling experience with a focus on supporting several product teams concurrently\\n* You are fluent in Python and SQL and have some lower-level understanding of programming language internals, Linux, and networking.\\n* You understand what separates good and bad data pipelines\\n* You are foremost an engineer, making you passionate about high code quality, automated testing, and engineering best practices\\n* You have the ability to self-manage, prioritize, and deliver functional solutions\\n* You possess advanced knowledge of analytical databases, software engineering practices, testing methodologies, and data analytics.\\n* You agree that concise and effective written and verbal communication is a must for a successful team\\n\\n\\n**Why you want to work here/Benefits/Perks**\\n\\nDoximity is proud to offer industry-leading benefits. Some of our offerings include:\xa0\\n* Medical, dental, vision offerings for you and your family\\n* 401k with matching program\\n* Family building support, Childcare FSA, and parental leave\\n* Life, AD&D, and Disability\\n* Generous time off, holidays and paid company trips\\n* Plus many more!\\n\\n**More About Doximity…**\\n\\nFounded in 2010, Doximity is the leading digital platform for medical professionals. The company’s network members include over 80% of physicians across all specialties and practice areas.\xa0 Doximity provides its verified members with digital tools built for medicine, enabling them to collaborate with colleagues, stay up-to-date with the latest medical news and research, manage their careers and conduct virtual patient visits. Doximity’s mission is to help doctors be more productive so they can provide better healthcare for their patients.\xa0 For more information, please visit Doximity.com.\\n\\nJoining Doximity means being part of an incredibly talented and humble team. We’re driven by the goal of improving inefficiencies in our $3.5 trillion U.S. healthcare system and love creating technology that has a real, meaningful impact on people’s lives. To learn more about our team, culture, and users, check out our careers page, company blog, and engineering blog. We’re growing fast, and there’s plenty of opportunity for you to make an impact—join us!""\\n\\n*Doximity is proud to be an equal opportunity employer, and committed to providing employment opportunities regardless of race, religious creed, color, national origin, ancestry, physical disability, mental disability, medical condition, genetic information, marital status, sex, gender, gender identity, gender expression, pregnancy, childbirth and breastfeeding, age, sexual orientation, military or veteran status, or any other protected classification. We also consider qualified applicants with criminal histories, consistent with applicable federal, state and local law.* \\n\\nBe sure to mention the word **ACCLAIM** when applying to show you read the job post completely. This is a beta feature to avoid spam applicants. Companies can search these words to find applicants that read this and see they\'re human.\\n\\n \\n\\n#Salary and compensation\\n\n$120,000 — $160,000/year\\n\n\\n\\n#Location\\n🇺🇸 US\n\n\n\n\nSee more jobs at Doximity\n\n\nVisit Doximity\'s website']",https://remoteok.com,REMOTEOK
Software Engineer Android,Doximity,💰 $120k - $150k,"San Francisco, California, United States",2021-12-06T16:37:32+00:00,https://remoteok.com/remote-jobs/107062-remote-software-engineer-android-doximity,"[""Doximity \n\n\n\ndoximity.com \n\n\nApply now\n\n\n🔎2,392 views\n\n\n✅ 1,016 applied\n(42%)\n\n\n\nDoximity is also hiring a:\n\n\n\nSr Software Engineer Data Infrastructure \nData Engineer Data Integration \nSite Reliability Engineer \nSr Software Engineer Data Platform \nData Analytics Manager  \n\n\nDoximity is hiring a Remote Software Engineer Android \nDoximity is transforming the healthcare industry. Our mission is to help doctors be more productive, informed, and connected.\xa0As a software engineer, you'll work within cross-functional delivery teams alongside other engineers, designers, and product managers in building software to help improve healthcare.\xa0\xa0\\n\\nWe put mobile first. We have built and maintain multiple fully-native Android and iOS apps that healthcare professionals use on a daily basis to increase productivity and provide better patient care.\\n\\nOur primary Android app uses Clean Architecture, written 100% in Kotlin. It utilizes a modular reactive architecture, which has drastically decreased feature development time and has made the development process much more pleasant. Click here to get more information about our stack on each platform.\\n\\nWe are looking for a talented Android Software Engineer to join our team of 10 Android engineers. Doximity is based in San Francisco, CA, but our entire Android team is remote! We embrace remote work life, using industry standard tools to collaborate.\\n\\nOur team\xa0brings a diverse set of technical and cultural backgrounds and we like to\xa0think pragmatically in choosing the tools most appropriate for the job at hand.\\n\\nOne of Doximity's\xa0core values\xa0is stretching ourselves. Even if you don't check off all the boxes below we encourage you to apply. Doximity is full of exceptional people that don't fit a mold, join us!\\n\\n**About You**\\n\\n* Knowledge of Kotlin and have experience building Android apps\\n* Some experience with Clean Architecture is preferred\\n* At least 2 years of professional experience with Android development using the Android SDK\\n* You stay up-to-date with latest patterns and libraries from the Android community\\n* You have some experience with testing on Android\\n* You possess an understanding of design patterns and with an eye for detecting their use case in the code\\n* Experience with async patterns, and network communication\\n* You are able to self-manage and have impeccable follow-through\\n* You are an clear communicator able to get your point across concisely and cohesively\\n* You have the desire to teach others how to excel as software engineers\\n\\n**How You'll Make an Impact**\\n\\n* You'll collaborate with a team of product managers, designers, QA, and other developers to drive mobile projects from beginning to end\\n* You'll be included in decision-making and will weigh in on balancing factors like scope, complexity, and timing\\n* You'll architect your code in a way that encourages and allows for flexible, modular, and reusable code\\n* You'll encourage growth within the team by participating in mentorship, knowledge sharing, and thorough code reviews\\n* You'll help keep our apps robust by writing tests, monitoring, reporting, and troubleshooting bugs\\n\\n**Benefits & Perks**\\n\\n* Generous time off policy\\n* Comprehensive benefits including medical, vision, dental, Life/ADD, 401k, flex spending accounts, commuter benefits, equipment budget, educational resources and conference access\\n* Family support and planning benefits\\n* Stock incentives\\n* and much more! For a full list, see our career page\\n\\n**About Us**\\n\\n* Here are some of the ways we [bring value to doctors](https://drive.google.com/file/d/1qimYh0mG3i1nTJe6jDCDepJt2i4o8MEB/view)\\n* Our\xa0web applications are\xa0built\xa0primarily\xa0using Ruby, Rails, Javascript (Vue.js), and\xa0a bit of\xa0Golang\\n* Our data engineering stack run on Python, MySQL, Spark, and Airflow\\n* Our production application stack is hosted on AWS and we deploy to production on average 50 times per day\\n* We have over 350 private repositories in Github containing our applications, forks of gems, our own internal gems, and [open-source projects](https://github.com/doximity)\\n* We have worked as a distributed team for a long time; we're currently over 65% distributed\\n* Find out more information on the [Doximity engineering blog](https://technology.doximity.com/)\\n\\nOur [company core values](https://work.doximity.com/)\\n\\nOur [recruiting process](https://technology.doximity.com/articles/engineering-recruitment-process-doximity)\\n\\nOur [product development cycle](https://technology.doximity.com/articles/mofo-driven-product-development)\\n\\nOur [on-boarding & mentorship process](https://technology.doximity.com/articles/software-engineering-on-boarding-at-doximity)\\n\\nJoining Doximity means being part of an incredibly talented and humble team. We work on amazing products that over 80% of US doctors (and over one million healthcare professionals) use to make their busy lives a little easier. We’re driven by the goal of improving inefficiencies in our $3.5 trillion U.S. healthcare system and love creating technology that has a real, meaningful impact on people’s lives. To learn more about our team, culture, and users, check out our careers page, company blog, and engineering blog. We’re growing fast, and there’s plenty of opportunities for you to make an impact—join us!\\n\\n*Doximity is proud to be an equal opportunity employer, and committed to providing employment opportunities regardless of race, religious creed, color, national origin, ancestry, physical disability, mental disability, medical condition, genetic information, marital status, sex, gender, gender identity, gender expression, pregnancy, childbirth and breastfeeding, age, sexual orientation, military or veteran status, or any other protected classification. We also consider qualified applicants with criminal histories, consistent with applicable federal, state and local law.* \\n\\nBe sure to mention the word **DIGNITY** when applying to show you read the job post completely. This is a beta feature to avoid spam applicants. Companies can search these words to find applicants that read this and see they're human.\\n\\n \\n\\n#Salary and compensation\\n\n$120,000 — $160,000/year\\n\n\\n\\n#Location\\n🇺🇸 US\n\n\n\n\nSee more jobs at Doximity\n\n\nVisit Doximity's website""]",https://remoteok.com,REMOTEOK
