Posicion,Empresa,Ubicacion,Fecha de publicacion,URL de la vacante,Descripción,Home URL,Nombre del Sitio,MIN Salario,MAX Salario,AVG Salario,currency,Sallary period
Lead Backend Developer,OperateBeyond,Worldwide,2021-12-11T19:00:06+00:00,https://remoteok.com/remote-jobs/107188-remote-lead-backend-developer-operatebeyond,"OperateBeyond 9,054 views 2,432 applied (27%) This job post is closed and the position is probably filled. Please do not apply. OperateBeyond is a fast growing technology company building web and mobile applications. We specialize in delivering top-notch user experiences paired with solid technology in non-auto vehicle software industry. Our successes come from our teamwork and mutual respect for each other’s talents and unique perspectives. So when we say we are looking for a PHP Developer we do want want you to be an awesome back-end developer who’s dabbled with many different projects. We are looking for someone who can hold their own when when it comes to system integrations, databases, and even be interested in understanding more about user experience to help us shape amazing products. **What you might do on any given day:** * Participate in daily meetings with your team of developers * Help developers with any roadblocks * Participate in calls with the product department * Coordinate and work with devops for version releases * Work with a variety of technologies and platforms such as PHP, ZF2, ZF1, Laravel, ElasticSearch, MySQL, Vue.js, jQuery and many more technologies we may introduce * Collaborate with product managers and technical leads * Develop comprehensive use cases and test conditions * Take part in analysis efforts, identification, and recommendation of solutions, integration points and related implementation architecture for business usage improvements, scalability and performance. * Provide guidance in the form of code review, solution design, and recommended training and development plans. * Write unit tests, specs, integration tests, UI tests * Advocate for new or improved development practices that increase craftsmanship, availability, resilience, and scalability of our solutions **We think you’ll enjoy working with our team if you:** * Bring a passion to stay on top of tech trends, experiment with and learn new technologies, participate in technology communities. * Can be flexible, agile, dependable, and responsive even when there are a lot of moving parts and prefer that over following rigid processes and guidelines. * Believe that good application development includes good testing, good documentation, and good collaboration. * Have great communication and reasoning skills, including the ability to make a strong case for technology choices while understanding other viewpoints and the need to find the best possible solution for everyone. * Have a positive yet practical attitude; You are willing to take on any task that might help take one of our products, or our company, a little further. Be sure to mention the words **BASKET NAPKIN VETERAN** when applying to show you read the job post completely. This is a beta feature to avoid spam applicants. Companies can search these words to find applicants that read this and see they're human. #Salary and compensation $70,000 — $150,000/year #Location Worldwide See more jobs at OperateBeyond",https://remoteok.com,REMOTEOK,70000,150000,110000.0,USD,Year
Senior Frontend Engineer,MomentRanks,Worldwide,2021-12-11T18:38:40+00:00,https://remoteok.com/remote-jobs/107625-remote-senior-frontend-engineer-momentranks,"MomentRanks momentranks.com Apply now 5,953 views 1,039 applied (17%) MomentRanks is hiring a Remote Senior Frontend Engineer **The Role** We're looking for an experienced, fast-moving frontend-focused software engineer who loves ideating on and implementing new features from 0 to 1. We work with NextJS, Tailwind, Storybook, and Typescript. **Our company** MomentRanks makes collecting *non-fungible tokens*, or NFTs, incredibly easy, fun, and social. NFTs can be collectibles, gaming items, domain names, digital art, and many other items backed by a blockchain. We want to be the entrypoint for tens of millions to discover, buy, and socialize around NFTs across blockchains and marketplaces. We launched in 2021 and already see over 150,000 monthly active users. We're backed by some of the best VCs in the crypto space, including Coinbase Ventures and Dapper Labs, and are growing incredibly fast. Check out our amazing community or our mentions in the New York Times, CNN, and Fortune. **Responsibilities** - Ideate and deliver on MVPs of new features quickly, with the agency to make decisions and deliver impact - Build flexible, scalable components that will help us serve millions of users and their diverse use cases - Create trustworthy user experiences by building interfaces that are simple, easy to comprehend, performant and reliable using modern tools like React, Typescript, and more. - Be excited to learn about the future of web technologies like web3.js and other cutting-edge practices - Add positive energy in every meeting, and make your coworkers feel included in every interaction. **Desired Experience** - An ability to write high quality code quickly, with a bias towards shipping. - 5+ years (or equivalent side projects) developing and ship user-facing features using component-based UI frameworks, ideally React. - Examples of work with beautiful design. Be sure to mention the word **CLEARS** when applying to show you read the job post completely. This is a beta feature to avoid spam applicants. Companies can search these words to find applicants that read this and see they're human. #Salary and compensation $180,000 — $240,000/year #Location Worldwide See more jobs at MomentRanks Visit MomentRanks's website",https://remoteok.com,REMOTEOK,180000,240000,210000.0,USD,Year
Senior Regulatory Counsel,Blockchain.com,"Buenos Aires, Buenos Aires, Argentina",2021-12-07T18:01:30+00:00,https://remoteok.com/remote-jobs/107608-remote-senior-regulatory-counsel-blockchain-com,"Blockchain.com is hiring a Remote Senior Regulatory Counsel Blockchain.com is the world's leading software platform for digital assets. Offering the largest production blockchain platform in the world, we share the passion to code, create, and ultimately build an open, accessible and fair financial future, one piece of software at a time. Having just acquired the SeSocio business, Blockchain.com has significantly increased its footprint in Latin America and signalled its commitment to the region. We are looking for an exceptional lawyer to take on this exciting role and join our fast-growing team as Regulatory Counsel (Latin America). You will be working on ground-breaking, novel regulatory matters in the crypto space, including pioneering new crypto licensing regimes, working closely with Blockchain.com’s Policy Team on crypto policy development, and helping shape the regulatory environment in Latin America. You will contribute to the P-REAL team (Product, Regulatory, Employment and Litigation) within the broader Legal department and have responsibility for regulatory matters as they pertain to the Latin American business. You will work with that business to address challenging legal and regulatory matters along our continued journey of growth. Practically speaking, this includes the provision of legal and regulatory support on a variety of matters spanning entity licensing and registration, product distribution, service provider relationships, and more. If you have experience in a fast-paced environment and are looking for an opportunity to be a founding member of the Legal Team, this is the perfect opportunity for you! WHAT YOU WILL DO Provide legal and regulatory support to the Latin American business on matters that affect Blockchain.com with an eye towards how they impact the business globally. Monitor, assess and advise the business on legal and regulatory issues that impact entity licensing and registration, product development and distribution. Support Blockchain.com in its various licensing and registration initiatives (Latin America). Partner with Compliance in respect of regulatory licensing matters and liaise with local regulators where necessary. Ensure that the Latin American business is aligned with applicable laws and regulations in Latin American (and coordinate with colleagues in the US, the UK and Europe). Work effectively across business units and product-related functions to resolve complex business and risk issues. Engage outside counsel relationships as necessary. WHAT YOU WILL NEED LLB/law degree and admission in a Latin American jurisdiction. 5+ years relevant regulatory experience; in-house FinTech experience a bonus. xa0 Proven high-performing legal experience in an in-house environment. Ability to work well under pressure with diligence, organisation, and minimal supervision, and provide practical, business-friendly advice to clients. Strong analytical and strategic skills; ability to drive issues to a quick resolution that factors in many non-legal variables, such as brand-risk, communications, government relations, tax, insurance, finance and other business units. xa0 High degree of professional ethics and integrity. Ability to anticipate legal issues or risks and to build the processes and systems to prevent them from occurring. COMPENSATION & PERKS Competitive salary based on experience and meaningful equity in an industry-leading company. Provided the latest Apple equipment Unlimited vacation policy, work hard and take time when you need it. #Salary and compensation No salary data published by company so we estimated salary based on previous jobs related to Senior, Non Tech and Crypto jobs that are similar: $70,000 — $120,000/year #Location Buenos Aires, Buenos Aires, Argentina See more jobs at Blockchain.com",https://remoteok.com,REMOTEOK,70000,120000,95000.0,USD,Year
Senior iOS Developer,Flightradar24,CET +/– 3 H,2021-12-07T16:02:27+00:00,https://remoteok.com/remote-jobs/107609-remote-senior-ios-developer-flightradar24,"Flightradar24 Apply now 2,068 views 269 applied (13%) Flightradar24 is hiring a Remote Senior iOS Developer We are looking for a talented iOS developer to join the team and help improve the world’s most popular flight-tracking app. You will play an important role in our app development team, implementing new features, improving performance and building beautiful interfaces. Above all, your work will impact the way millions of users experience Flightradar24. ### What you’ll do * Collaborate with a small team of developers, designers, and product owners to find end-to-end solutions to important problems and features * Contribute to the continuous work of refactoring and modernizing our app and developing and maintaining a high-quality codebase * Deliver modern, testable, and maintainable code adhering to iOS development best practices * Participate in knowledge sharing and team work with the other developers in your team ### Who you are * You have at least 4 years of professional iOS app development experience, preferably on app(s) with a large user base * You have experience working with Swift and preferably also Objective C * You care about quality and you know what it means to ship high-quality code * You have experience with writing automated tests (unit tests, UI tests, etc.) * You have experience with refactoring and modernizing an app, e.g. with regards to modernizing architecture, testability, patterns, etc. * You have experience interacting with Firebase APIs, Maps APIs, or other external API services * You have strong written and spoken English *Note that this is a fully remote position, but we would like you to be located within a 3-hour time difference from Central European Time (CET/CEST) to align your working hours with the rest of the team.* ### About Flightradar24 With over 2 million daily users, Flightradar24 is the world’s most popular flight tracking service and our apps regularly top the App Store and Google Play charts. We also offer a wide range of commercial services and customers include many of the largest names in aviation. We're constantly adding new services and improving existing products. To help us meet those challenges, we're looking for creative, collaborative and tech-savvy applicants to join us. Be sure to mention the word **STYLIZED** when applying to show you read the job post completely. This is a beta feature to avoid spam applicants. Companies can search these words to find applicants that read this and see they're human. #Salary and compensation $70,000 — $130,000/year #Location CET +/– 3 H See more jobs at Flightradar24",https://remoteok.com,REMOTEOK,70000,130000,100000.0,USD,Year
Data Scientist Marketing,Figma,San Francisco or New York or Remote US,2021-12-01T17:38:07+00:00,https://remoteok.com/remote-jobs/107477-remote-data-scientist-marketing-figma,"Figma is hiring a Remote Data Scientist Marketing Figma is adding to our team of passionate people who are revolutionizing the world of design. We are building a browser-based design tool that looks and feels as good as a native application and has all the additional power and advantages that come from being built upon the web platform. If you’re looking to work at a dynamic company who is building the future of design tools, welcome to Figma. We are looking for a Data Scientist to partner with our Marketing teams to accelerate growth at Figma. In this role, you will be responsible for building models to optimize our marketing efforts, uncovering insights to guide new strategies, and collaborating with a variety of cross functional peers to help leverage data throughout the organization. The ideal candidate will have a strong track record of executing analytical projects as well as partnering closely with business peers to guide decision making. This is a full time role that can be held from one of our US hubs or remotely in the United States. About Figma Dylan Field and Evan Wallace co-founded Figma in 2012 with the vision of building tools for designers in the browser. Their goal was to create the first design tool that combined the accessibility of the Web with the functionality of a native app. Today Figma is a platform with tools and spaces to support the entire product development process—idea to design to build—and has simplified collaboration for companies like Microsoft, Uber, and The New York Times to name a few. xa0 At Figma, we celebrate and support our differences. We know employing a team rich in diverse backgrounds, experiences, and opinions allows our employees, products, and community to flourish. Figma is an equal opportunity workplace—we are dedicated to equal employment opportunities regardless of race, color, ancestry, religion, sex, national orientation, sexual orientation, age, citizenship, marital status, disability, gender identity, or Veteran status. By applying for this job, the candidate acknowledges and agrees that any personal data contained in their application or supporting materials will be processed in accordance with the applicable candidate section of xa0Figma's Privacy Policy. #Salary and compensation No salary data published by company so we estimated salary based on previous jobs related to Executive, Ops and Marketing jobs that are similar: $60,000 — $100,000/year #Location San Francisco or New York or Remote US See more jobs at Figma",https://remoteok.com,REMOTEOK,60000,100000,80000.0,USD,Year
Cloud Consultant,Amazon Web Services,🇺🇸 US,2021-11-20T12:16:12+00:00,https://remoteok.com/remote-jobs/107279-remote-cloud-consultant-amazon-web-services,"'Amazon Web Services is hiring a Remote Cloud Consultant Job ID: 1800266 | Amazon Web Services, Inc. Location is flexible anywhere in the contiguous United States, however access to a major airport is required for travel purposes. Are you interested in helping the customers implement innovative cloud computing solutions and solve technical problems? Would you like to do this using the latest cloud computing technologies? Do you have a knack for helping these groups understand application architectures and integration approaches, and the consultative and leadership skills to launch and guide a project to success? Are you familiar with security best practices for applications, servers, and networks? Do you want to be part of the team helping to establish Amazon Web Services (AWS) as a leading technology platform? Be part of our Professional Services team! Amazon Web Services is looking for highly talented and technical architects to help accelerate our growing Professional Services business. This is an excellent opportunity to join Amazon’s world class technical teams, working with some of the best and brightest engineers while also developing your skills and furthering your career within one of the most innovative and progressive technology companies. AWS Professional Services engages in a wide variety of cloud migration and cloud adoption projects for customers and partners, providing collective experience from across the AWS customer base. We’re obsessed about delivering strong success for our Customers - we collaborate across the entire AWS organization to bring access to product and service teams so we deliver the right solution and drive feature innovation based on customer needs. We are looking for people that have: · A strong understanding of large scale computing solutions across the full enterprise stack. The ideal candidate will be a hands-on technical expert and have past experience working as a consultant. With AWS, you will keep your existing technical skills honed and develop new ones as you lead architecture discussions and proof of concept buildouts for customers. You will regularly take part in deep-dive education and hands-on design exercises to create world-class cloud solutions built on AWS. · A background of deep technical expertise supporting customers in at least one of the following enterprise technology areas: server/OS management; network management; cloud migration and deployment; database and middleware management; full lifecycle enterprise software development; DevOps pipeline build and management; storage and virtualization management. · An understanding of enterprise software development tools and methodologies, including typical enterprise application architectures and the ability to write basic scripted or compiled code. · A mix of advanced technology and strategic business acumen as well as a demonstrated ability to engage in senior level technology decision maker discussions related to the business value of AWS services and offerings. · Demonstrated ability to think strategically about business, product, and technical challenges. Our Consultants work with Federal Government customers in a variety of locations across the US. As such, Consultants must have the ability to travel to client locations to sell and deliver professional services as needed. This can vary depending on the customers supported, 30% to 50% can be typical, sometimes higher during peak times. Please check with the hiring team for more information. This position requires the candidate selected be a US citizen because it provides services under a federal government contract and who can obtain and maintain a Public Trust. Inclusive Team Culture Here at AWS, we embrace our differences. We are committed to furthering our culture of inclusion. We have twelve employee-led affinity groups, reaching 40,000 employees in over 190 chapters globally. We have innovative benefit offerings, and we host annual and ongoing learning experiences, including our Conversations on Race and Ethnicity (CORE) and AmazeCon (gender diversity) conferences. Amazon’s culture of inclusion is reinforced within our 14 Leadership Principles, which remind team members to seek diverse perspectives, learn and be curious, and earn trust. Work/Life Balance Our team also puts a high value on work-life balance. Striking a healthy balance between your personal and professional life is crucial to your happiness and success here, which is why we aren’t focused on how many hours you spend at work or online. Instead, we’re happy to offer a flexible schedule so you can have a more productive and well-balanced life—both in and outside of work. Mentorship & Career Growth Our team is dedicated to supporting new members. We have a broad mix of experience levels and tenures, and we’re building an environment that celebrates knowledge sharing and mentorship. We care about your career growth and strive to assign projects based on what will help each team member develop into a better-rounded professional and enable them to take on more complex tasks in the future. BASIC QUALIFICATIONS · 7+ or more years of design/implementation/consulting experience with enterprise technologies in support of distributed applications. · 2+ years of hands on AWS services implementation experience · Hands-on experience leading the design, development and deployment of business software at scale or current hands on technology infrastructure, network, compute, storage, and virtualization experience · Hands-on technical skills in at least one of the following: server/OS management; network management; cloud migration and deployment; database and middleware management; full lifecycle enterprise software development; DevOps pipeline build and management; storage and virtualization management. · Demonstrates experience with software development tools and methodologies, including basic ability to write scripted or compiled code. · Demonstrates experience presenting technical material to both technical and nontechnical clients. · B.S. in Computer Science or Information Systems, or equivalent degree and/or experience. PREFERRED QUALIFICATIONS · AWS Solutions Architect Professional certification or similar Professional certifications · Strong track record of implementing AWS services in a variety of distributed computing environments · Demonstrates experience in running complex projects. · Experience building sophisticated and highly automated infrastructure. · High level of skill communicating effectively across internal and external organizations. · Demonstrates ability to adapt to new technologies and learn quickly. · Demonstrates ability to be comfortable speaking with executives, IT Management, and developers. · Demonstrates ability to work in a diverse team Pursuant to the San Francisco Fair Chance Ordinance, we will consider for employment qualified applicants with arrest and conviction records. Pursuant to the Los Angeles Fair Chance Ordinance, we will consider for employment qualified applicants with arrest and conviction records. For employees based in Colorado, this position starts at $125,000 per year. A sign-on bonus and restricted stock units may be provided as part of the compensation package, in addition to a range of medical, financial, and/or other benefits, dependent on the position offered. Amazon is committed to a diverse and inclusive workplace. #US_WWPS_ProServ #US_WWPS_ProServ_SLGEDU Amazon is committed to a diverse and inclusive workplace. Amazon is an equal opportunity employer and does not discriminate on the basis of race, national origin, gender, gender identity, sexual orientation, protected veteran status, disability, age, or other legally protected status. For individuals with disabilities who would like to request an accommodation, please visit https://www.amazon.jobs/en/disability/us. #Salary and compensation $120,000 — $200,000/year #Location 🇺🇸 US See more jobs at Amazon Web Services'",https://remoteok.com,REMOTEOK,120000,200000,160000.0,USD,Year
