Technical Customer Support Manager,SaaS Industries GmbH,Worldwide,2021-12-08T19:10:14+00:00,https://remoteok.com/remote-jobs/107632-remote-technical-customer-support-manager-saas-industries-gmbh,"SaaS Industries GmbH Apply now 1,919 views 559 applied (29%) SaaS Industries GmbH is also hiring a: PHP API Developer SaaS Industries GmbH is hiring a Remote Technical Customer Support Manager We launched saas.industries in 2019 and specialized in developing and marketing API products. We currently provide our solutions to hundreds of businesses in multiple niches, all around the globe. As our company's first full-time support manager, you will be responsible for designing & building support processes together with the founding team. You will be required to act as a primary escalation target for any technical or subscription-related issue. You will be handling every support issue personally, either through email, web-meeting, or chat communication. **Why You Should Apply** - We are 100% bootstrapped - you enjoy low hierarchies & appreciate direct communication with the founders - You want complete control over your development and working environment. - You thrive in a remote working environment where you may never meet your co-workers in person; you go wherever you want - You understand how essential clear, consistent communication is when working remotely -- ambiguity makes you uncomfortable **Skills You Should Have** - Good oral and written communication skills - Strong technical knowledge in networking systems - Strong analytical skills - Ability to prioritize and manage tasks. - Excellent time management and problem-solving skills. - Exceptional customer service skills **What You Can Expect From Us** - tA competitive salary - tFlexible and fair working hours - tCalm and asynchronous company environment - tFocus on deep work instead of meetings - tExtensive onboarding to your new work environment - tOpportunity for performance-based bonuses and salary increases - tA healthy level of autonomy; We will provide consistency in expectations and support. - tTransparent, direct and clear communication Be sure to mention the word **STRAIGHTEN** when applying to show you read the job post completely. This is a beta feature to avoid spam applicants. Companies can search these words to find applicants that read this and see they're human. #Salary and compensation $30,000 — $60,000/year #Location Worldwide See more jobs at SaaS Industries GmbH",https://remoteok.com,REMOTEOK,30000,60000,45000.0,USD,Year
PHP API Developer,SaaS Industries GmbH,🇪🇺 EU,2021-12-08T19:02:58+00:00,https://remoteok.com/remote-jobs/107631-remote-php-api-developer-saas-industries-gmbh,"'SaaS Industries GmbH Apply now 1,299 views 304 applied (23%) SaaS Industries GmbH is also hiring a: Technical Customer Support Manager SaaS Industries GmbH is hiring a Remote PHP API Developer We launched saas.industries in 2019 and specialized in developing and marketing API products. We currently provide our solutions to hundreds of businesses in multiple niches all around the globe. As the first full-time software developer at our company, you will be responsible for designing, building, and improving our existing PHP/Laravel based web application backend while following/implementing current best practices and test-driven methodologies. You will be required to act as an escalation target for support issues that may require engineering assistance & infrastructure assistance. Also, you will improve our current products and participate in the development of new products. **Why You Should Apply** - You like rapid prototyping - We are 100% bootstrapped - you enjoy low hierarchies & appreciate direct communication with the founders - You want complete control over your development and working environment. - You thrive in a remote working environment where you may never meet your co-workers in person; you go wherever you want - You understand how essential clear, consistent communication is when working remotely -- ambiguity makes you uncomfortable **Skills You Should Have** - Knowledge of PHP, Laravel - Nice to have: Node.js, Python, & Vue.js - Willingness to learn new technologies - A get it done attitude and proven background of delivering beautiful work again and again - Excellent communication and fluent English **What You Can Expect From Us** - A competitive salary - Flexible and fair working hours - Calm and asynchronous company environment - Focus on deep work instead of meetings - Extensive onboarding to your new work environment - Opportunity for performance-based bonuses and salary increases - A healthy level of autonomy; We will provide consistency in expectations and support. - Transparent, direct, and clear communication Be sure to mention the word **CONTINUITY** when applying to show you read the job post completely. This is a beta feature to avoid spam applicants. Companies can search these words to find applicants that read this and see they 're human. #Salary and compensation $40,000 — $80,000/year #Location Worldwide See more jobs at SaaS Industries GmbH'",https://remoteok.com,REMOTEOK,40000,80000,60000.0,USD,Year
Senior Software Quality Assurance,Komoot,🇪🇺 EU,2021-12-08T18:50:33+00:00,https://remoteok.com/remote-jobs/107630-remote-senior-software-quality-assurance-komoot,"Komoot komoot.de Apply now 896 views 80 applied (9%) Komoot is hiring a Remote Senior Software Quality Assurance # About komoot Komoot is an app that lets you find, plan, and share adventures. Driven by a desire to explore, and powered by the outdoor community’s recommendations, it’s Komoot’s mission to inspire great adventures making them accessible to all. And we’re good at what we do: Google and Apple have listed us as one of their Apps of the Year numerous times! Today, with over 25 million users and 200,000 five-star reviews, Komoot is well on its way to becoming the most popular cycling and hiking app for people who love adventures worldwide. **Join our fully remote team and change the way people explore!** **About the role** You’ve got a head for processes, an eye for detail and you love being the first to test out new features in the wild. As a member of the komoot Quality Assurance team you'll play a key role in delivering new, bug-free features to our users worldwide. We work in cross-functional squads so you’ll work with a range of people from product managers and designers, to developers and data analysts to bring new features into the world. And you’ll simultaneously help to shape our quality practices with the rest of the QA team. **Ready for your next adventure?** **What you will do** - Perform exploratory tests, both indoors and outside, to ensure an exceptional user experience for komoot’s mobile (Android and iOS) apps and website - Work with product managers and designers to refine features and contribute to requirements - Provide test feedback and pair up with developers to test the features throughout the development process - Keep an overview of bug reports and prioritize them in collaboration with our product, development and customer support teams - Manage our manual test suites - Support the developers maintaining our automated test suites **Why you will love it** - You’ll team up with Pedro and Artur to define and scale QA processes, enabling exceptional-quality feature delivery in fast development cycles - You’ll take ownership of quality from day one, moving things forward, shaping the processes and choosing the tools you need to do your best work - You’ll work on a truly inspiring product that brings real-life value to our users and empowers them to explore more of the great outdoors - Your expert knowledge will make you a key player amongst a team of highly motivated and talented people. You’ll feel challenged to continuously learn and excel in your domain - You’ll travel together with our team (when safe & legal) to amazing outdoor places several times a year to exchange ideas, learnings and go for hikes and rides - You’ll improve a product that we’re pretty sure you’ll end up using for your personal outdoor adventures - This is a remote role and you are free to work from anywhere that lies between the time zones UTC-1 and UTC+3. - A sunny beach? Snowy mountains? Or a co-working space (covered by us)? **You will be successful in this position if you** - Have proven experience providing quality assurance for high-quality Android, iOS and web apps (5+ years) - Have the ability to investigate the root cause of bugs and document them consistently - Love to understand every detail of a product and its impact on our users - You believe quality is a collective effort rather than one person’s responsibility - Have strong analytical skills, are highly self-driven, reliable and keen to learn - Possess excellent interpersonal and communication skills and no ego – we’re a team and have always achieved incredible results together - Bonus: You know about automated mobile testing with Espresso or XCUITest **Sound like you?** We would love to hear from you! Please send us the following: - Your CV in English highlighting your most relevant experience - A write-up explaining who you are and why you are interested in working at komoot - Feel free to send us something that shows us a little more about what you’re interested in, be it your Twitter/Instagram account or your blog. **Curious to find out more about our recruitment process?** - Find out more info here: https://www.komoot.com/jobs-process - At komoot, we want to make great adventures accessible to everyone. We support diversity and inclusivity within the outdoors and welcome all prospective applicants. - We have a rolling recruitment process. If this role is online it means it’s still open. We’re accepting applications and actively looking for the perfect candidate. Is it you? **Perks** - Dedicated time and budget to spend on classes, events, conferences, boot camps, or books for your curiosity and personal development, you decide! - Get access to generous discounts from leading outdoor and cycling brands and more - Flexible working hours and locations - 3 all- expenses paid Company gatherings per year - The latest devices and equipment - And more! Be sure to mention the word **AWARD** when applying to show you read the job post completely. This is a beta feature to avoid spam applicants. Companies can search these words to find applicants that read this and see they're human. #Salary and compensation No salary data published by company so we estimated salary based on previous jobs related to Quality Assurance, Developer and Senior jobs that are similar: $60,000 — $110,000/year #Location 🇪🇺 EU See more jobs at Komoot Visit Komoot's website",https://remoteok.com,REMOTEOK,60000,110000,85000.0,USD,Year
Senior Android Developer,Komoot,Worldwide,2021-12-08T18:41:48+00:00,https://remoteok.com/remote-jobs/107629-remote-senior-android-developer-komoot,"Komoot komoot.de Apply now 774 views 39 applied (5%) Komoot is hiring a Remote Senior Android Developer # About komoot Komoot is an app that lets you find, plan, and share adventures. Driven by a desire to explore, and powered by the outdoor community’s recommendations, it’s Komoot’s mission to inspire great adventures making them accessible to all. And we’re good at what we do: Google and Apple have listed us as one of their Apps of the Year numerous times! Today, with over 25 million users and 200,000 five-star reviews, Komoot is well on its way to becoming the most popular cycling and hiking app for people who love adventures worldwide. **Join our fully remote team and change the way people explore!** **About the role** You’ll team up with four world class Android engineers and take over full responsibility for our Android app. You’ll work on all parts of the Android app and make outdoor adventures easily accessible to our users. You’ll develop diverse features for navigation, routing, social interaction and content visualization that will make your work challenging and fun. **Ready for your next adventure?** **What you will do** - Develop innovative new features from the first idea and concept over to road map planning, implementation, testing, release and monitoring. - Work in one of our cross-functional squads of backend, web and mobile developers, designers, copywriters, QA, data scientists, and product experts. - Team up with Arne, James, Dmitry and Iwo to build a state of the art Android app with more than 5 million active installs and up to 3 million monthly active users. - Release frequently with continuous builds, testing and direct team feedback. **Why you will love it** - You’ll work with a truly inspiring product that brings real life value to our users and empowers them to explore more of the great outdoors. - You’ll work on challenging tasks, like maps, data synchronization, turn-by-turn navigation and nearly everything the Android platform offers. - Your expert knowledge will make you a key player amongst a team of highly motivated, talented people. - We believe good ideas and commitment count more than titles. - This is a remote role and you are free to work from anywhere that lies between the time zones UTC-1 and UTC+3. - Beach? The mountains? Or a co- working space (covered by us)? - You’ll have a self-determined job with personal responsibility to move things forward, shape the processes and choose the tools you need to do your best work. - You’ll travel with us (when safe) for team gatherings in amazing locations several times a year. You can check out this playlist to find out more about how we stay close while being remote. (http://bit.ly/39xtIrn) - You get 38 days annual leaves (including public holidays, which vary by country) **You will be successful in this position if you** - Are highly self-driven, responsible and keen to learn and improve. - Love to develop awesome products with a focus on great user experiences. - Have 4+ years of professional experience with developing high quality production native Android apps. - Have 3+ years of professional experience with Kotlin. - Have 3+ years of professional experience with Java. - Keep your knowledge about Android and Android development up to date. - Write code that's readable, well documented and meaningfully tested. - Know how to build a scalable Android app architecture. - Are a great team player and communicator in a diverse international and fully remote team. **Sound like you?** Great, we would love to hear from you! Please send us the following: - Your CV in English highlighting your most relevant experience. - A covering letter explaining who you are and why you are interested in working at komoot. - Examples of your work (e.g. apps, GitHub, your private projects, etc.) - Feel free to send us something that shows us a little more about what you’re interested in, be it your Twitter/Instagram account, or your OpenStreetMap profile if you have one. **Curious to find out more about our recruitment process?** - Find out more info here: https://www.komoot.com/jobs-process - At komoot we want to make great adventures accessible to everyone. We support diversity and inclusivity within the outdoors and welcome all prospective applicants. - We have a rolling recruitment process. If this role is online it means it’s still open. We’re accepting applications and actively looking for the perfect candidate. Is it you? **Perks** - Dedicated time and budget to spend on classes, events, conferences, boot camps, or books for your curiosity and personal development, you decide! - Get access to generous discounts from leading outdoor and cycling brands and more - Flexible working hours and locations - 3 all- expenses paid Company gatherings per year - The latest devices and equipment - And more! Be sure to mention the word **PROMPTLY** when applying to show you read the job post completely. This is a beta feature to avoid spam applicants. Companies can search these words to find applicants that read this and see they're human. #Salary and compensation No salary data published by company so we estimated salary based on previous jobs related to Developer, Android and Senior jobs that are similar: $60,000 — $110,000/year #Location 🇪🇺 EU See more jobs at Komoot Visit Komoot's website",https://remoteok.com,REMOTEOK,60000,110000,85000.0,USD,Year
Full Stack Node. JS Express React Developer with Shares,Combined,Worldwide,2021-12-08T17:58:35+00:00,https://remoteok.com/remote-jobs/107626-remote-full-stack-node-js-express-react-developer-with-shares-combined,"Combined Apply now 1,304 views 232 applied (18%) Combined is hiring a Remote Full Stack Node. JS Express React Developer with Shares **About us** We are a SaaS startup, working on an exciting process management tool, that helps companies run their processes on autopilot, with step-by-step tasks, a bit like Zapier. xa0 We are a funded startup and already have an MVP done, and now want to speed up the development. We are looking for 2 full-stack developers, one with more focus on the backend, and one with more focus on the frontend. Our tech stack includes React.js, Node.js, Express, AWS, Elastic Search, PostgreSQL, Docker. This is a long-term, full-time, engagement (30 hrs a week minimum). In case the collaboration works well you'll be given the opportunity to get a share in the startup after a few months. **Responsibilities** Full Stack development, but 75% focus on either backend or frontend. You'll join 2 other developers who have been working on the product Work with the product manager and UX designer to come up with the best way to design and implement a feature. Give technical feedback and input on the UX designer and Product manager, tester, i.e. point out issues, missing user stories, etc. **Required skills** Backend: You have at least 1 year of experience with Node.js plus a popular framework like express / hapi / koa /etc (or 3 years if the Backend is your focus) Frontend: You have at least 1 year of experience with react. (or 2 years if the frontend is your focus) Ideally, you worked on a B2B SaaS app, or similar, before. Database: Experience with AWS RDS Aurora (PostgreSQL) or similar and able to properly design a normalized database using migrations. Ability to view problems and solutions from both a higher level and with respect to the architecture. Hence, consistency, holistic thinking are paired with analytical problem-solving skills. Strong communication skills (written and verbal) and reasonably fluent in English. We are open to talent from anywhere in the world and your working hours are very flexible. We only require that for at least 3 days a week, 3 of your working hours overlap the hours of 13:00-19:00 in Germany to facilitate team meetings (we try to keep meetings to a minimum). We are not looking for an agency at the moment and subcontracting of some of your work is not allowed. **Question? Or apply right away?** If you have any questions about this position, don't hesitate to contact email xa0protected (not: .com). xa0 To apply please send your CV to xa0email xa0protected, no motivation letter is required. We will send you some short screening questions to answer, which we will use to select a shortlist of candidates that we will interview. A skill test might is part of the process. Be sure to mention the word **YOUTHFUL** when applying to show you read the job post completely. This is a beta feature to avoid spam applicants. Companies can search these words to find applicants that read this and see they're human. #Salary and compensation $30,000 — $90,000/year #Location Worldwide See more jobs at Combined",https://remoteok.com,REMOTEOK,30000,90000,60000.0,USD,Year
Senior Linux App Developer,Tuple,Worldwide,2021-12-08T16:22:11+00:00,https://remoteok.com/remote-jobs/107623-remote-senior-linux-app-developer-tuple,"Tuple tuple.app Apply now 1,030 views 73 applied (7%) Tuple is hiring a Remote Senior Linux App Developer *tl;dr: We're looking for a strong C++ dev with experience creating great Linux apps to lead development of our new client.* ## xa0**Who we are** **Tuple(https://tuple.app/)** xa0is a macOS app for remote pair programming (with a xa0**Linux client(https://tuple.app/linux)** xa0on the way). We (**Ben(https://twitter.com/r00k)**, xa0**Spencer(https://twitter.com/spencercdixon)**, and xa0**Joel(https://twitter.com/robamaton)**) founded the company three years ago because we disliked pairing over Slack and Zoom. We believed that by focusing on remote pairing exclusively, we could create a tool that developers would actually like. Turns out we were right! We've grown to millions in revenue and tens of thousands of paid users in three years without any outside funding. Our product is used by the savvy engineers at companies like Shopify, Stripe, Spotify, and Netflix. (Want the latest on how things are going? Ben hosts xa0**a weekly podcast(https://artofproductpodcast.com/)** xa0where he shares regular updates.) ## xa0**Role overview** For the first 4 years of its life, Tuple was available only on macOS. However, our users kept requesting a Linux client (and we love making our users happy), so we decided to build one. Over the last year, we split the old app into a macOS-specific component and a cross-platform real-time communication engine (using customized WebRTC under the hood). Additionally, we've created a Linux version of our application (built atop the cross-platform engine) and launched a small alpha to early users. On March 1st, 2022, we hope to make the (now polished, reliable, and close to feature parity) Linux version of Tuple generally available. This project is currently owned by our CTO, with support from the rest of our 3-person Engineering team. We're looking for someone with significant Linux app development experience to join this project, make substantial contributions, and quickly take over primary responsiblity for development of the Linux client. This role reports to our CTO, xa0**Spencer(https://twitter.com/spencercdixon)**. ## xa0**Things you'll do a lot** - Collaborate with our Product Designer to turn mocked-up features into shipped code - Pair program with our other engineers to spread knowledge, foster connections, and make work more fun - Collaborate with folks in Success/QA to fix bugs affecting our customers - Use your hard-won wisdom to make savvy architectural decisions about the codebase - Provide feedback to our Product folks about how to make the app feel at home in the Linux ecosystem - Write tests for your code to prevent regressions ## xa0**Must-haves** - Warmth, kindness, and a willingness to pair program regularly (using Tuple, obvi) - Deep knowledge of C++ and C - Significant experience with UNIX/POSIX - A work day with 4+ hours of overlap with Boston's - Multiple years of experience building apps with GTK - Comfort debugging distro-specific issues (you probably have 5+ VMs on your machine already) - Comfort interfacing with X11 APIs ## xa0**Nice-to-haves** - Experience with PulseAudio APIs - Experience with GTKMM - Experience with OpenGL - Experience writing tests with Catch2 - Experience distributing Linux apps with Snap, Flatpak, or AppImages - Knowledge of the GNOME HIGs and an interest in building apps that are good citizens on the platforms they target - Upstream patches merged into GTK or GTKMM/other open source GTK app examples - You know what LFS is and maybe even completed it yourself - You've written your own widget toolkit and event loop on top of X11 for fun/education - You have a well groomed dotfiles system ## xa0**Why you might want to work with us** - We're quite small (fewer than 10 employees), so there are no layers of bureaucracy to work through. You can have a huge impact here. - We rarely have meetings and are very flexible on work schedules. - Our team is warm and friendly but highly productive. - You'll have a front-row seat at an early-stage, fast-growing company. If you hope to start your own thing someday, this could be good preparation. ## xa0**Why you might not want to work with us** - Tuple is a complicated app! There will be lots to learn before you can be truly productive. - While we host several in-person retreats per year, you'll spend most of your time working remotely. ## xa0**Salary** We're looking for someone great, not someone cheap. If you're expensive but amazing, we'll make it work. Be sure to mention the word **EBULLIENCE** when applying to show you read the job post completely. This is a beta feature to avoid spam applicants. Companies can search these words to find applicants that read this and see they're human. #Salary and compensation $150,000 — $300,000/year #Location Worldwide See more jobs at Tuple Visit Tuple's website",https://remoteok.com,REMOTEOK,150000,300000,225000.0,USD,Year
