Senior Software Engineer,Inex One,Worldwide,2021-12-13T08:35:55+00:00,https://remoteok.com/remote-jobs/107667-remote-senior-software-engineer-inex-one,"Inex One Apply now 392 views 27 applied (7%) Inex One is hiring a Remote Senior Software Engineer Hello there Thanks for your interest in Inex One! I'm Filip, one of the founders and tech leads of Inex One. I’ll be reviewing your application if you choose to apply 🙂 . Let's get it straight out of the way: you would be Engineer #7 in a team that also has two designers and one PM. In total, Inex One is made up of 17 colleagues, from Singapore to New York. Below you'll find detailed sections on what we think you should know about us before deciding to join us. This is pretty texty, so feel free to hop down to the sections that interest you most! #### The story of Inex One When my co-founders Max, Mehdi, Josefine and I started Inex One in Stockholm early 2018 we set out to improve global knowledge sharing. Knowledge (in the form of research reports, access to experts, data etc.) is still hard to come by: it’s expensive, siloed and hard to find. If you have ever wondered why management consultants exist this is one of the reasons - they have access to data that no one else has. The expert network industry is one of those industries that almost no one has heard of, but still has an enormous impact. In short it’s all about helping organizations get in contact with experts to provide insights and information. It is also an industry with huge margins, lots of inefficiencies and a pricing model (huge up-front contracts) that keeps smaller organizations out. This is where we decided to start. On the surface this might seem like a pretty dull industry. I strongly disagree, but never mind that, dull is a good place to be as a startup. The anonymous, dull and high margin parts of the B2B world is where a startup can succeed without giving away the entire company to VCs and without waiting 10 years for profitability. During the past three years we've helped organizations small and large come in contact with thousands of experts. We have a small and effective team that believes in working smarter, not harder. It's amazing what a small team of focused and capable individuals can accomplish through effective teamwork. We don't have many meetings, and most of our work happens asynchronously on GitHub and Slack. Everyone is included and can see every discussion or decision they want to contribute to. Right now I think Inex is really at a sweet spot. Small enough that every team member can have a significant impact. Large enough that we can offer a stable working environment, competitive salaries, solid project management and well defined tasks. Close to profitability, growing steadily with strong investor backing. We are now focused on growing into a stable and profitable company without additional external investment. #### The product Our product connects organizations doing research with expert networks that are specialized in finding experts in different fields and geographies. We support over 20 expert networks and hundreds of clients, doing dozens of expert calls every day. Our clients come in all shapes and sizes such as consultancies, corporates, PE funds and non-profits. We are proud to have clients on all continents except Antarctica (not yet!). There is a lot of work of the typical CRUD + notifications type on the platform. But we also have elements of recommendation algorithms, NLP (transcripts, summaries, sentiment analysis), browser plugins, search and our own conferencing system (built on top of Twilio). We try to be pragmatic about product management and we've learned a lot. In the beginning we thought we knew more than we did and spent a lot of time on the wrong things. Nowadays we take UX, planning and user interviews very seriously. For any larger tasks we create working groups consisting of UX, tech and business that shape a feature together before detailed designs and coding begin. We don’t adhere to any specific methodology, most seem geared towards larger companies, but have taken inspiration from agile and shape-up. #### Upcoming technical work * 50% creating larger features based on client or expert network needs. Some examples of upcoming projects are improved search, transcript summaries and better calendar management. * 20% smaller features. Often it's little product changes that can add lots of value. This often involves learning more about user needs in order to come up with the best and simplest solution. * 10% bug fixes, at most. Thanks to really solid CI, decent tests and consistent code written for readability and maintainability we have few bugs that are usually easy to fix. * 20% devOps, tech debt elimination and work on improving the developer experience. We prioritize ease of development very highly and have for the past year always had at least one team member focus on this. #### Requirements ##### Skills * 5+ years in software development * Experience of leading software development work * The ability to ship solid, testable and readable code (preferably React, Node & Typescript - but not a must, we know that good senior developers learn new languages and frameworks quickly anyway) * Understand how web apps work and have a good understanding of deployments, browsers, servers etc. * Effective written and verbal English * Able to communicate with other people on the project team effectively * bonus Experience with DevOps, search (such as Elastic), NLP, postgres, React, Node, Typescript ##### Personality * Eager to take ownership and lead the development of one of our product areas * Willing to learn, grow and work as a team * Believe that empathy and effective communication is important * Preference towards the simplest solution rather than the most technically interesting one * Pragmatic and able to make decisions with incomplete information, not afraid to ask for clarification * Strong sense of responsibility for upholding product stability and quality * After the first 6 months we expect you to * Have shipped several features * Be communicating effectively in the team * Be leading engineering decisions #### The codebase Our philosophy has always been to keep things simple and readable. The business we are in will never lead to huge traffic volumes so it’s better to focus on developer productivity, simplicity and security rather than optimizations, advanced infrastructure and microservices. The entire codebase is written in typescript with React+Node+Postgres. This was a very conscious choice because it allows code sharing and lets developers move seamlessly between the front and back end. This is great because it allows for more varied tasks and a deeper understanding of the system as a whole. Here are some points about how we do things currently * We release multiple times per week (merge to master = release) * We share lots of types and files between the frontend and the backend, since it's all typescript! * Monorepo setup using Yarn workspaces. Linting, code styling and type checking throughout the codebase. Everything is integrated with VSCode. * GitHub workflow. PRs close GitHub issues that we manage in a Kanban board. Every PR deploys a full working environment where backend and frontend can be accessed live. #### Remote work at Inex Inex is remote first, we are currently 6 developers living in 6 different countries. That means our processes are built for remote work from the get go. Code reviews, pair programming and joint planning sessions are built into the process. As are (very short) daily standups, retrospectives and times when we can share what we have built and learned. Still there is something that happens when you meet face to face, have a nice dinner and a beer or two. We make sure to have regular retreats together and visit each other. In November the entire team came to Paris to visit Mehdi. In the beginning of 2022 the whole company will come and visit me in Stockholm. The role is remote but we are currently open to candidates within 2 hours of our timezone (CET) in order to reduce issues with meeting times and synchronous collaboration. #### Some of the people at Inex Below is a selection of people at the company. I mention these five because I think they show that we know what we are doing. We have started companies before, we have been customers of and worked at expert networks. **Max Friberg**: Our CEO, previously a huge consumer of expert calls at McKinsey as well as a founder of an expert network. The guy behind our SEO (try googling “expert network”). https://www.linkedin.com/in/maxfriberg **Josefine Vinberg**: Our COO, with a background in tech product management and running a large tech team at Widespace. Sharp business thinker, and a champion of “doing one thing really really well”. https://www.linkedin.com/in/jvinberg/ **Filip Gruvstad**: Co-CTO, did a brief stint at McKinsey and also did some expert calls. Before Inex he’s been CTO & co-founder at 2 other marketplace startups (Yepstr is still alive and kicking). A fan of good food, techno and structured code! https://www.linkedin.com/in/filipgruvstad **Mehdi Rejraji**: Co-CTO, absolutely brilliant developer and previous co-founder and CTO at Airnum. A champion of remote-first work, and of our expert network partners. https://www.linkedin.com/in/mehdirejraji **Ana Price**: Head of Product. Recently joined Inex to lead product management, after 8 years at the world’s largest expert network GLG. Ana is planning a number of exciting additions to the platform. https://www.linkedin.com/in/ana-price-16513978/ #### Here are some of the perks of the job * Ability to have an impact from day 1 * Fun, sharp and diverse set of colleagues * Freedom and responsibility to set your own schedule * Work from home (or from a co-working space) * Regular team retreats to fun locations * Low amount of time spent in meetings * Yearly budget for learning and development * Computer & phone setup of your choice * Financially stable company * Sizable equity compensation * Market rate salary compensation In the interest of transparency please consider xa0**these reasons not to join us**: * You prefer working in a “ticket factory” where each ticket is precisely defined, you do it and then you forget about it and move on. This is still a small company, you are expected to think for yourself: what could make this task better? What have we missed? etc. * You think more features and complex technology is the best way to solve all problems. * You want to spend all day writing complex algorithms and optimizing code to shave off the last millisecond. It does happen, but not often, problem solving for us is mostly about figuring out customer needs and trying to solve them in the cleanest most simple way possible. Be sure to mention the word **SUPPORTED** when applying to show you read the job post completely. This is a beta feature to avoid spam applicants. Companies can search these words to find applicants that read this and see they're human. #Salary and compensation $60,000 — $100,000/year #Location Worldwide See more jobs at Inex One",https://remoteok.com,REMOTEOK,60000,100000,80000.0,USD,Year
Reception Manager Nammos Mykonos,Nammos World,Dubai,2021-12-13T10:45:07+00:00,https://remoteok.com/remote-jobs/107669-remote-reception-manager-nammos-mykonos-nammos-world,"'Nammos World is hiring a Remote Reception Manager Nammos Mykonos If you’re ready to create an energetic scene that is magnetic around the world, then we invite you to explore a career with us. Join our international team as a Reception Manager. Reception Manager responsibilities include: * Always provide a warm and friendly welcome to all our guests and visitors * Ensure excellent customer service delivery throughout the front of house functions in cooperation with the Department Managers * Sets an example for team members of commitment, activities, work ethics, habits and personal character * Leading, monitoring, motivating, and inspiring the team; providing guidance and support * Ensure front desk is tidy and has all necessary stationery and material (e.g., pens, forms, and informative leaflets) * Handle complaints and specific guests’ requests * Implements ongoing development of skills and knowledge for the FOH team * To be fully familiar with regular and VIP guests * Act as an ambassador for the restaurant and help to market & promote all internal events * Plan rota’s and ensure correct team member levels are on shift at any time * Building strong customer relations – develop positive relations <br/><br/> To be a successful Reception Manager you should possess the following qualifications: * Proven 2 years of work experience as a Front Desk Manager or Reception Manager in upscale, high-end restaurant or hotel * Excellent Knowledge of English. Knowledge of additional foreign languages will be considered as an advantage * Outstanding attention to detail, encouraging a culture of high standards throughout the team * Experience of working in a highly customer focussed service delivery role * The ability to lead and develop a large, diverse team * Excellent problem-solving skills * Degree in Hospitality/Tourism Benefits Nammos Group offers a competitive salary with international career development opportunities in our properties Worldwide. By joining our team, you will have the opportunity to work in a stimulating and motivating environment that values and is committed to its employees. If this sounds like you, then we invite you to explore a career with us. Only applications with cover letters and photos will be reviewed. #Salary and compensation No salary data published by company so we estimated salary based on previous jobs related to Executive jobs that are similar: $70,000 — $100,000/year #Location Dubai See more jobs at Nammos World'",https://remoteok.com,REMOTEOK,70000,100000,85000.0,USD,Year
Team Leader,Utility Warehouse,Worldwide,2021-12-12T10:00:01+00:00,https://remoteok.com/remote-jobs/107664-remote-team-leader-utility-warehouse,"Utility Warehouse is hiring a Remote Team Leader Remote Customer Service Team Leader xa0 Competitive salary xa0 Hours: 40 hours per week, Monday to Saturday 8am to 8:30pm Location: Home-based Start date: As soon as possible Hello, we’re UW You probably won't have heard much about us, but we're one of the UK's biggest, home-grown success stories of the last 20 years. We're a FTSE 250 business and knocking on the door of £1 billion in annual revenue. xa0 We provide your energy, broadband, mobile and ho me insurance in one. So you can stop thinking about bills, passwords and price comparisons, and get on with the important things in life. And we know we’re onto something - we have been Which? awarded for 10 years running - but we’re only just getting started… Want a sneak peak into what it’s like to work for us? https://vimeo.com/showcase/6052297/video/341298006 Overview of the role The Team Leader is responsible for driving performance through engagement, motivation and ensuring a sense of belonging for every member of the team. It’s all about creating the right employee experience to deliver the right customer experience. You’ll be supported by Lead Advisors and Subject Matter Experts who will focus on knowledge and technical coaching to help your advisors provide great customer service. xa0 Key result areas: xa0 - Achieving operational KPIs - Team engagement, performance and length of service - Setting expectations - Two way communication - represent your team to the company and the company to your team - Be organised so your team know what their doing and when - Driving a culture xa0Departmental relationships xa0 - Be an advocate for change What’s on offer? - A competitive salary xa0 -33 days of holiday including bank holidays - Pension scheme offered from day one xa0 - Great benefits such as our share scheme after six months, discount on services and much more! - Full equipment provided - Full remote IT support About you - Proven success at managing a team in a fast paced customer service environment - Remote management experience is desirable - Emotionally Intelligent - Motivating and engaging - Excellent communication skills - Adaptable with a positive attitude towards challenges and change xa0 - Organised Don’t forget though, you’ll need to be eligible to live and work in the UK. What you’ll need We’ll supply the equipment needed for you to do the role but you will still need a strong internet connection. Our minimum requirement for internet speed is 10Mbps Download and 4Mpbs Upload. A dedicated, quiet work space with a work station, plenty of natural light, access to fresh air and no distractions. This cannot be a communal xa0 space that is shared by other household members nor a through route to any communal space such as the kitchen. xa0 Next steps Do you have what it takes to be part of our award-winning Customer Service team? Apply now and you’ll receive a link to our online assessment process within 48 hours. #Salary and compensation No salary data published by company so we estimated salary based on previous jobs related to Executive jobs that are similar: $70,000 — $100,000/year #Location Remote See more jobs at Utility Warehouse",https://remoteok.com,REMOTEOK,70000,100000,85000.0,USD,Year
Founding Engineer,Fella Health (YC W20/S21),🇪🇺 EU,2021-12-11T17:01:02+00:00,https://remoteok.com/remote-jobs/107659-remote-founding-engineer-fella-health-yc-w20-s21,"'Fella Health (YC W20/S21) Apply now 829 views 58 applied (7%) Fella Health (YC W20/S21) is hiring a Remote Founding Engineer ## About Fella Health **Fella Health(https://www.joinfella.com/) is the telehealth clinic for men with obesity, backed by Y Combinator.** With Fella, patients meet a board-certified obesity doctor to prescribe FDA-approved medications, while they undertake personalized health coaching through our app. Obesity is the largest chronic disease in the US (>$100bn spent each year) and the traditional solution (move more, eat less) only works long-term for ~10% of people. But obesity treatment is radically changing due to a new wave of medication options which are 2-3x more effective than previous options. In addition, only 10% of those using weight management services are men: all programs market to women, not tackling the stigma men feel around this. Fella 's founders are Luke(https://www.linkedin.com/in/luke-harries) & Richie(https://www.linkedin.com/in/richard-cartwright). We studied together at Cambridge University. Luke xa0studied medicine and developed a patented AI approach to detecting cancer xa0at a YC bio company, before moving to Microsoft Research. He did a masters in Computer Science after Cambridge. Richie xa0personally struggled with stress eating for 6 years. After Cambridge, he built and sold an AI company working with the UK government. He built a 10k-follower community around men 's stress eating. You can read more about working at Fella here: https://fella.notion.site/Working-at-Fella-14a2ac8575d34d148d009bb410387af4(https://www.notion.so/Working-at-Fella-14a2ac8575d34d148d009bb410387af4) Fella Health is live in Texas, and we recently closed a Seed round to expand nationwide. We 're backed by top health/consumer investors: - Y Combinator - BrandProject, Global Founders Capital - The founders of Indeed, Curative, Alan, Kaia Health, Not Boring, Vouch Insurance ## The opportunity as Founding Engineer Fella is building a world-class team. As the first engineering hire at Fella, you 'll be taking over work from our technical co-founder, executing in both growth & product teams. This role is a critical part of the broader founding team because you will build the technical foundations of the company for years to come. This role is FTE and fully remote. You 'll work closely with the founders, and report directly to Fella 's CEO xa0Luke Harries(https://www.linkedin.com/in/luke-harries/). ## Key responsibilities - xa0**Growth — Architecture** - You 'll work with our Head of Growth & co-founders to design & implement a tight growth tech stack. You 'll ensure growth has accurate analytics (e.g. Mixpanel), smooth information flow (e.g. Segment, data warehouse, ETL), important tooling (e.g. CRM). - xa0**Product — Architecture** - You 'll work with our CEO (Head of Product) to design & implement a tech stack to ensure a smooth flow of information. You 'll architect and build out the data pipelines to ensure the data warehouse & postgres databases are complete, piping data to the doctor and coaching tools. You 'll design the infrastructure for our mobile app backend to enable us to quickly iterate. - xa0**Growth — CRO** - You 'll work with our Head of Growth & co-founders to analyze the signup funnel, develop hypotheses, prioritize & design experiments, build changes, evaluate results — all to improve conversion. You 'll move very quickly, while keeping security high and tight data privacy. - xa0**Product — Customer dev** - You 'll work with our co-founders to turn customer insights into product features. You 'll interview users to shape the product roadmap, prioritize features ruthlessly, and co-create wireframes with our designer. - xa0**Product — Shipping** - You 'll work with our CEO (Head of Product) to regularly ship high-quality features. You 'll launch the React (Typescript) and Next.js experience of the Fella app. You 'll co-create our iOS and Android deployment CI/CD pipeline. ## Need to have - Technical & product skills: - *Experience*: 3+ years experience as an engineer - *Frontend*: shipped high-quality apps in either React Native or React - Cultural skills: - xa0**End-to-end ownership** xa0— you are comfortable owning projects from noticing the problem to delivering the outcome. - xa0**Commitment to candor** xa0— we believe in open communication and transparency. You are a clear & caring communicator, welcoming feedback. - xa0**Belief in the mission** xa0— we will help 1 million fellas by 2026. We have a lot of work to do, and you are dedicated to the mission. - xa0**Do what is needed** xa0— speed is critical and often the solutions we need are messy. You are comfortable moving quickly and taking on work outside your job description. - xa0**Dedication to excellence** xa0— you are obsessed with your role, with a commitment to compounding self-improvement. ## Nice to have - Technical & product skills: - *Backend*: databases (SQL), system design (cron jobs), servers (node.js), data engineering (warehouses, ETL) - *Analytics*: event analytics (Mixpanel, PostHog) and experimentation (A/B, multivariate) - *Frontend*: Typescript, Next.js - *No-code*: Zapier, Retool, Google App Scripts, Webflow - *Devops*: CI/CD, GCP or AWS EC2 - *Customer dev*: experience with customer interviews and turning customer insights into features - *Design*: Figma, UX experience - *Growth*: UTM tags, ad pixels, customer attribution, prioritizing experiments - *Background*: CS degree, previously launched own products/startup, comfortable at hackathons - Cultural skills: - xa0**Seeing systems** xa0— you recognize the system which produces the outcome, and focus on improving the system to fix the true cause of an issue. - xa0**Positive-sum thinking** xa0— you think in terms of collaboration not competition. - xa0**Managing yourself** xa0— you own your schedule, your habits, your happiness, your life. Your team-members help you flourish, but the eventual responsibility lies with you. ## Benefits - *Compensation*: competitive salary, equity, xa0and unlimited PTO - *Pension*: 401(k) contributions - *Healthcare*: private medical insurance - *Family*: paid parental leave - *Personal development*: budget for books, courses, coaching - *Personal wellness*: budget for gym, health apps - *Team*: regular off-sites - xa0**What are we missing?** xa0We 're still early so you get to shape our culture. Be sure to mention the word **ADMIRINGLY** when applying to show you read the job post completely. This is a beta feature to avoid spam applicants. Companies can search these words to find applicants that read this and see they 're human. #Salary and compensation $100,000 — $200,000/year #Location Worldwide See more jobs at Fella Health (YC W20/S21)'",https://remoteok.com,REMOTEOK,100000,200000,150000.0,USD,Year
