Staff Senior Software Engineer DevOps,Ad Hoc Team,"Halifax, Nova Scotia",2021-12-10T20:10:05+00:00,https://remoteok.com/remote-jobs/107650-remote-staff-senior-software-engineer-devops-ad-hoc-team,"Ad Hoc Team is hiring a Remote Staff Senior Software Engineer DevOps This is a remote position. Some Federal contracts require U.S. citizenship to be eligible for employment. Ad Hoc is a digital services company that helps the federal government better serve people. Our team of experts from across commercial industry and government brings the modern skills necessary to help agencies transform public services into digital services. Our work enables agencies to meet the needs of their users while closing the gap between consumer expectations and government. Infrastructure engineers are our authorities on implementing xa0DevOps xa0methodologies, building tools and services to allow application teams and others to self-service, and driving cross-team communications to ensure we ship stable and performant services. xa0We’re looking for a driven and organized Infrastructure Engineer to help guide our teams in delivering the very best digital services for the American people. Staff Software Engineers generally lead cross-functional, technical teams of 3 to 6 engineers (including themselves) and are the individuals primarily responsible for ensuring successful delivery for their team. They generally establish high levels of trust and operate with significant autonomy. This position is reserved for individuals with significant development and leadership experience. Staff Software Engineers are accountable for the code and systems they own, lead the resolution of major issues effectively and direct the evaluation of tradeoffs between implementation complexity and other costs. They have expert-level capabilities in at least one major technology stack. Requirements Minimum 7 years of experience in software design, development, architecture and operations * Bachelor of Science in Technology or Engineering What You'll Do * Collaborate across teams to consolidate and simplify DevOps tools and services, then support other infrastructure engineers using them in production * Build libraries, modules, and packages for other infrastructure engineers to integrate with their projects * Develop Continuous Integration / Continuous Delivery (CI/CD) processes to help deliver software of higher quality at greater speed * Work closely with our government partners and app teams to ensure that we are shipping software that meets security, SLA, and performance requirements * Solve problems in ways that drive towards simplicity of architecture and operations * Ship software that impacts the lives of millions of Americans What You'll Bring * Experience automating infrastructure, testing, or deployments of a web-based application with tools like Jenkins, Ansible, Terraform or Packer * Experience with DevOps Tooling (Terraform/Ansible/AWS) Monitoring (Prometheus/Grafana) Container Orchestration Developer Experience (GitHub-backed SCM and Issues) * Experience with Frontend (React/Redux) Backend (Rails) a big plus * 4+ years experience with Amazon Web Services (AWS), Google Cloud Platform (GCP) or Microsoft Azure. * Understanding of basic networking fundamentals: TCP/IP, UDP, routing, load balancing. * Experience and understanding of one or more different agile methodologies, including Scrum, XP, or SAFe. * Automation of applications through RESTful APIs Ensuring effective engineering delivery on their program or team. Contributing to and delivering performance reviews with direct reports. Developing and presenting monthly reports based on program reporting requirements. Shaping the technical direction of their program. xa0 Managing the technical relationship with the client, and influencing their technical decision-making. xa0 Demonstrating a deep awareness of how changes they make interact with all components in a broader system. This includes technologies for frontend, backend, infrastructure, usability, and design, as well as varying development, testing, and release methodologies within an organization. Planning and executing on roadmaps for new projects without explicit guidance and direction from technical supervisors. xa0 Actively driving conversations and planning sessions with partners and key stakeholders, and representing the engineering practice while advocating for the best technical solutions and communicating tradeoffs. Ultimately providing significant positive impact to a program’s roadmap. Influencing the customer toward successful outcomes by establishing trust through reliable and successful execution and demonstrated competency. Providing vision for other engineers within their area of influence, and advocating for that vision while taking into account client requirements. xa0 Prioritizing high-impact work and delivering on that work over non-critical tasks. xa0 xa0 Periodically traveling to the client site to work with and present to partners and stakeholders as necessary. xa0 Elaborating and evolving on complex and ambiguous products to uncover new constraints and opportunities. Assigning tasks to and monitor the progress of task completion for team members. Providing mentorship and guidance to team members through practice, code review, presentations, and architecture. This may include, but isn’t limited to game day design and execution. Providing general career development advice to team members, and staying up to date on career options and new opportunities within the company that may be beneficial for the growth of those engineers. Reducing ambiguity in the systems they work with, including additional documentation, refactoring, and testing. xa0 Effectively communicate on existing systems, design decisions, past performance, and a major history of the projects that they’ve been part of for bid-writing, tech demos, and other potentially client-facing communications. xa0 Informing program leadership of the health of your team and contributing to evaluation of team members, written or otherwise Actively contributing code and performing code review on your applications as an engineer. xa0 Participating in technical depth interviews with new candidates Conducting regular 1:1 meetings and performance reviews with direct reports; providing general career development advice to team members based on their knowledge of company policy and process Creating opportunities for improving not just their immediate area, but similar areas in other programs across the company. xa0 Ensure that all systems operate smoothly and, in coordination with QA Manager, align with ISO and CMMI quality standards. To learn more about engineering at Ad Hoc. Benefits Company-subsidized Health, Dental, and Vision Insurance Use What You Need Vacation Policy 401K with employer match Paid parental leave after one year of service Continuing education/annual conference attendance stipend Ad Hoc LLC is an Equal Opportunity/Affirmative Action Employer. All qualified applicants will receive consideration for employment without regard to race, color, national origin, ancestry, sex, sexual orientation, gender identity or expression, religion, age, pregnancy, disability, work-related injury, covered veteran status, political ideology, marital status, or any other factor that the law protects from employment discrimination. xa0 #Salary and compensation No salary data published by company so we estimated salary based on previous jobs related to Developer, DevOps and Senior jobs that are similar: $70,000 — $120,000/year #Location Phoenix, Arizona, United States See more jobs at Ad Hoc Team",https://remoteok.com,REMOTEOK,70000,120000,95000.0,USD,Year
Golang JavaScript Developer for Fairdrive Protocol,Swarm Associaton,"Boston, MA or San Francisco (Bay Area), CA",2021-12-09T19:15:03+00:00,https://remoteok.com/remote-jobs/107646-remote-golang-js-developer-for-fairdrive-protocol-swarm-associaton,"'Swarm Associaton is hiring a Remote Golang JavaScript Developer for Fairdrive Protocol Neuchatel, Switzerland, Switzerland - Swarm is a system of peer-to-peer networked nodes that create a decentralised storage and communication service. The system is economically self-sustaining due to a built-in incentive system enforced through smart contracts on the Ethereum blockchain.Swarm aspires to ... #Salary and compensation No salary data published by company so we estimated salary based on previous jobs related to Golang, Developer and JavaScript jobs that are similar: $60,000 — $110,000/year See more jobs at Swarm Associaton'",https://remoteok.com,REMOTEOK,60000,110000,85000.0,USD,Year
Analytics Engineer,dbt Labs,"San Diego, California, United States",2021-12-09T14:00:03+00:00,https://remoteok.com/remote-jobs/107642-remote-analytics-engineer-dbt-labs,"dbt Labs is hiring a Remote Analytics Engineer dbt Labs is a remote-first company with a globally distributed team. This role is open to folks based anywhere in the United States. dbt Labs is an equal opportunity employer. We're committed to building an inclusive team that welcomes a diversity of perspectives, people, and backgrounds regardless of xa0race, color, national origin, gender, sexual orientation, age, religion, disability, citizenship, veteran status, or any other protected status. We feel strongly that whether or not your experience exactly fits the job description, your passion and skills will stand out and set you apart even if your career has taken some twists and turns. xa0 If you are on the fence about whether you meet our requirements, we encourage you to apply anyway! Please reach out to us directly at xa0email xa0protected xa0if you need assistance or accommodation due to disability. About Us dbt Labs was founded in 2016 to empower analysts to create and disseminate organizational knowledge. Since then, we’ve grown to become one of the most respected brands in the analytics industry. Our product, dbt, is used by thousands of companies. Who we are At dbt Labs, we have developed strong opinions on how companies should practice analytics. Specifically, we believe that: - Code, not graphical user interfaces, is the best abstraction to express complex analytic logic - Data analysts should adopt similar practices and tools to software developers - Critical analytics infrastructure should be controlled by its users as open source software - Analytic code itself u200a— u200anot just analytics tools u200a— u200awill increasingly be open source It turns out that a lot of other people believe this too! Over the course of the past several years we've built a community of 20,000+ people and 5,000 companies who are using our ideas, products, and workflows to conduct analytics, including Lyft, Monzo, GitLab, Snowflake, the ACLU, Amazon, JetBlue, and RentTheRunway. Our product, xa0dbt, has come to be synonymous with the practice of analytics engineering, defining an entire industry. We’re backed by top investors including Andreessen Horowitz and Sequoia Capital, recently raising our series C: read the announcement xa0here! We’re looking for an experienced Analytics Engineer to join our Professional Services team. We help startups set up their initial analytics infrastructure and Fortune 1000 companies migrate to modern analytics tools. The work is challenging, to say the least. In return, you’ll be able to work with one of the most talented data teams in the country and with some of the most exciting companies in the world. Sound like something you’re interested in? We’d love to hear from you. #LI-Remote #Salary and compensation No salary data published by company so we estimated salary based on previous jobs related to Stats, Engineer jobs that are similar: $65,000 — $112,500/year #Location US - Distributed See more jobs at dbt Labs",https://remoteok.com,REMOTEOK,65000,113000,89000.0,USD,Year
JD Logistics Sales Manager,JD.com,"New York, New York, United States",2021-12-09T09:10:04+00:00,https://remoteok.com/remote-jobs/107639-remote-jd-logistics-sales-manager-jd-com,"JD.com is hiring a Remote JD Logistics Sales Manager Location: City of Industry, CA/ Remote during COVID-19 Pandemic Job Type: Full-time Job Description JD xa0Logistics is looking for a results-driven individual with supply chain sales experience to boost sales of supply chain products in American market. The Sales Manager is responsible for directing the e-commerce B2C sales activities, while coordinating with cross-functional departments within the business unit. The Successful Sales Manager Will: * Appropriately manage the underlying activities needed to achieve or exceed margin and profitability goals for the region. * Participate in overall e-commerce B2C services and processing with a focus on improving fulfillment and operational excellence. * Develop and optimize product models. Monitor market dynamics, including customer and competitor developments and funnels relevant information in the industry. * Manage and participate in the development and scheduling of special projects such as exhibition, public relations events, promotions, etc. * Have strong business sense with the ability to drive the growth, directly impact the building of new solutions, services across JD Logistics’ growing footprint. * Provide continuous feedback to management on both successes and challenges of the business. * Provide input to the development of strategic sales plans that reflect the company's business strategy to advance market share and achieve profitable growth. Essential Qualifications * More than 2 years relevant experience in e-commerce, sales, and/or supply chain industries. * Strong business sense of internet industry. * Proven track record of sales achievement. * Successful track record in directly driving business, maintaining client relationships and people management. * Excellent leadership, influencing, organization, communication, interpersonal and teamwork skills. * BA/BS required. Preferred Qualifications * Experience working in a fast-paced environment with multiple priorities and tight deadlines. xa0 About JD.com JD.com is China’s largest online retailer and its biggest overall retailer, as well as the country’s biggest Internet company by revenue. JD.com sets the standard for online shopping through its commitment to quality, authenticity, and its vast product offering covering everything from fresh food and apparel to electronics and cosmetics. Its unrivalled nationwide fulfillment network provides standard same- and next-day delivery covering a population of more than 1 billion - a level of service and speed that is unmatched globally. As a technology-driven company, JD.com builds reliable and scalable platforms that bring value to partners and customers in sectors such as e-commerce, logistics, Internet finance, cloud computing and smart technology. For more information, visit https://corporate.jd.com/home About JD Logistics JD Logistics, a business group under JD.com, which leverages the company’s advanced technology and logistics expertise to provide smart supply chain and logistics services to businesses across a wide range of industries. JD.com has one of the largest fulfillment infrastructure of any e-commerce company in the world. JD.com is the only e-commerce platform in the world to provide small-to-medium sized warehousing, oversized warehousing, cross border, cold chain delivery, frozen and chilled warehousing facilities, B2B and crowdsourcing logistics. We believe technology innovation can drive smart logistics. JD built the world’s first fully-automated warehouse in Shanghai, and we are currently developing our own drones delivery and automatic delivery robots. For more information, visit https://www.jdworldwide.com/jdl xa0 JD.com is an Equal Opportunity Employer. We do not discriminate in our employment decisions on the basis of race, sex, sexual orientation, gender, color, religion, age, genetic information, medical condition, disability, marital status, citizenship or national origin, and military membership or veteran status, or on any other basis which would be in violation of any applicable federal, state or local law. #Salary and compensation No salary data published by company so we estimated salary based on previous jobs related to Executive, Sales jobs that are similar: $60,000 — $80,000/year #Location Industry, California, United States See more jobs at JD.com",https://remoteok.com,REMOTEOK,60000,80000,70000.0,USD,Year
Office Manager Teilzeit,Valsight,"New York, NY",2021-12-09T07:25:04+00:00,https://remoteok.com/remote-jobs/107638-remote-office-manager-in-teilzeit-valsight,"'Valsight is hiring a Remote Office Manager Teilzeit Über uns: Wir haben Valsight gegründet, um Unternehmen mehr Sicherheit und Planbarkeit xa0in einem dynamischen und komplexen Umfeld zu bieten. Mit unserer Software für xa0agiles Controlling unterstützen wir das Management dabei, per Knopfdruck alle xa0relevanten Informationen zu bekommen, um schnell und flexibel auf xa0Veränderungen und komplexe Fragestellungen reagieren zu können. xa0Anwender:innen und Entscheider:innen im xa0Finanzbereich können so strategische xa0Entscheidungen schneller besser treffen. Namhafte Unternehmen wie Siemens, xa0Mercedes-Benz, xa0Volkswagen, AIDA Cruises oder Thalia nutzen bereits unsere xa0Software und haben so ihre Unternehmenssteuerung verbessern sowie die xa0Effizienz in Planungsprozessen steigern können. Deine Aufgaben: * Du achtest mit Liebe zum Detail darauf, dass sich alle Mitarbeiter:innen im Office wohlfühlen * Du kümmerst dich um organisatorische und administrative Office-Management-Aufgaben * Du unterstützt unsere HR Abteilung bei der Organisation von Teamevents und Company Partys sowie dem Onboarding * Du greifst auch anderen Teams bei organisatorischen Angelegenheiten unter die Arme <br/><br/> Was du mitbringst: * Du bringst relevante Berufserfahrung mit - optimalerweise in einem Start-up Umfeld * Du hast Spaß daran, mehrere Bälle parallel zu jonglieren und bist ein Naturtalent in der Organisation und Kommunikation * Du arbeitest selbständig und begegnest neuen Situationen mit Flexibilität und Offenheit * Du überzeugst durch eine strukturierte Arbeitsweise, auch bei hohem Arbeitsaufkommen * Du beweist u202fKommunikationsstärke auf Deutsch und dir macht es Spaß dich mit deinen Kolleg*Innen auf Englisch zu unterhalten Was wir dir bieten: * Durch Freiräume und Verantwortung helfen wir dir bei der Umsetzung eigener Ideen und deiner Weiterentwicklung * Mentoring und regelmäßiges Feedback gehören bei uns neben einem attraktiven Gehalt zu den Grundpfeilern einer erfolgreichen Laufbahn * Die Start-Up-Atmosphäre und flache Hierarchien helfen uns, gemeinsam unsere Ziele zu erreichen * Culture makes performance. Unsere Core Values aktiv zu leben ist zentraler Bestandteil unseres Arbeitsalltages. Auch in Zeiten von remote work achten wir sehr auf ein gutes Teamgefühl, das Feiern von Erfolgen, transparente Kommunikation, Weiterentwicklung u.v.m. * Training- und Weiterbildungsbudget xa0 * Betriebliche Altersvorsorge * Mitarbeiterrabatte durch Corporate Benefits * Kostenfreie Getränke, wie Tee, Fair Trade Kaffee, ChariTea, Bionade und Mate * Kostenfreie Frühstücksmöglichkeit durch unsere Müsli-Bar. Du xa0sagst uns welches Müsli du gerne frühstückst und wir bestellen es * Wir möchten dir ein attraktives Arbeitsumfeld bieten, auf deinen Wunsch stellen wir die Materialien, die du für einen optimalen Arbeitsablauf benötigst. Das kann z.B. eine ergonomischen Maus, dein Lieblingsgetränk, Snacks deiner Wahl, zucker-/laktosefreie Milchalternativen und vieles mehr sein Liebe Frauen, bitte keine falsche Zurückhaltung! Untersuchungen haben ergeben, dass Frauen ihre Erfolgschancen im Wettbewerb tendenziell geringer einschätzen als Männer. Frauen bewerben sich erst dann auf eine offene Position, wenn sie der Überzeugung sind, alle Anforderungen zu erfüllen. Wenn Du nicht alle gewünschten Kriterien erfüllst, aber dennoch den größten Teil des Anforderungsbereiches mitbringst, möchten wir dich ermutigen, dich dennoch bei uns zu bewerben. Lass uns gemeinsam herausfinden, ob wir zueinander passen. Wir freuen uns auf deine Bewerbung! Alle qualifizierten Bewerber werden ungeachtet ihres Geschlechts, ihrer Geschlechtsidentität, ihrer sexuellen Orientierung, ihrer Rasse, ihrer Hautfarbe, ihrer Religion, ihrer nationalen Herkunft, ihrer Behinderung, ihres Alters oder anderer gesetzlich geschützter Merkmale bei der Einstellung berücksichtigt. Die Einbeziehung von Menschen mit Behinderungen entspricht unserem Selbstverständnis und wir begrüßen daher Ihre Bewerbung. Du hast Lust, deine Kenntnisse und deine Fähigkeiten bei uns in vielfältigen Bereichen auszubauen? Du willst dabei einer spannenden Mission folgen und mit einem großartigen Team arbeiten? Dann bist du bei Valsight genau richtig! Für Rückfragen steht dir Carolina jederzeit unter email xa0protected zur Verfügung. Liebe Personalvermittler:innen! Wir besetzen alle Stellen selbst und sind daher nicht an Personalvermittlungen interessiert! Bitte senden Sie uns nicht unaufgefordert Profile zu. Vielen Dank für Ihr Verständnis! #Salary and compensation No salary data published by company so we estimated salary based on previous jobs related to Executive jobs that are similar: $70,000 — $100,000/year #Location Berlin See more jobs at Valsight'",https://remoteok.com,REMOTEOK,70000,100000,85000.0,USD,Year
Senior Software Engineer Backend,Reddit,"Boston, Massachusetts, United States",2021-12-09T01:15:05+00:00,https://remoteok.com/remote-jobs/107636-remote-senior-software-engineer-backend-reddit,"'Reddit is hiring a Remote Senior Software Engineer Backend San Francisco, United States - Reddit is a network of more than 100,000 communities where people can dive into anything through experiences built around their interests, hobbies and passions. Reddit users submit, vote and comment on content, stories and discussions about the topics they care about th... #Salary and compensation No salary data published by company so we estimated salary based on previous jobs related to Golang, Developer and Senior jobs that are similar: $70,000 — $120,000/year See more jobs at Reddit'",https://remoteok.com,REMOTEOK,70000,120000,95000.0,USD,Year
Senior Ruby On Rails Developer,Nomadix,"Toronto, ON",2021-12-08T22:31:14+00:00,https://remoteok.com/remote-jobs/107634-remote-senior-ruby-on-rails-developer-nomadix,"Nomadix is hiring a Remote Senior Ruby On Rails Developer Who Are We? With more than 25 years of experience, Nomadix enables over 5 million daily internet connections in over 150 countries. Its patented gateways are the industry standard in hospitality, supporting millions of rooms worldwide. The company provides a suite of solutions that enhances the guest experience. From in-room entertainment with TV casting, Wi-Fi, cloud PBX phone service travellers feel at home wherever they go. Angie by Nomadix delivers contactless technology and offers patented voice and touchscreen capabilities in purpose-built solutions for the hotels including the world's first 24-hour interactive guest room assistant, and mobile app solutions. What Youll Do If you are looking for an excellent opportunity to join a friendly, creative, and actively growing team where youll have plenty of ownership and the potential to develop your distinct expertise, we look forward to hearing from you. The role requires the successful candidate to assist us in designing and developing exciting new products and services while maintaining our existing products portfolio. Youll primarily interact with our Development/QA/Devops teams who are located in the UK to facilitate successful production releases of new features. However, youll also work with a wider Product team that is located remotely, and in different time zones around the globe. Benefits What We Offer * Contract or permanent position subject to your location * Competitive compensation package * Stock options * Flexible working hours * Fully remote working (occasional travel for team meetings may be needed) * Equal opportunity employer #Salary and compensation No salary data published by company so we estimated salary based on previous jobs related to Developer, Ruby and Senior jobs that are similar: $70,000 — $120,000/year See more jobs at Nomadix",https://remoteok.com,REMOTEOK,70000,120000,95000.0,USD,Year
